

================================================================
== Vitis HLS Report for 'top_kernel_Pipeline_VITIS_LOOP_48_5'
================================================================
* Date:           Sat Jan 31 16:06:19 2026

* Version:        2025.1.1 (Build 6214317 on Sep 11 2025)
* Project:        project_1
* Solution:       hls (Vivado IP Flow Target)
* Product family: zynquplus
* Target device:  xczu3eg-sbva484-1-e


================================================================
== Performance Estimates
================================================================
+ Timing: 
    * Summary: 
    +--------+----------+----------+------------+
    |  Clock |  Target  | Estimated| Uncertainty|
    +--------+----------+----------+------------+
    |ap_clk  |  10.00 ns|  3.385 ns|     2.70 ns|
    +--------+----------+----------+------------+

+ Latency: 
    * Summary: 
    +---------+---------+----------+----------+-----+-----+------------------------------------------------+
    |  Latency (cycles) |  Latency (absolute) |  Interval |                    Pipeline                    |
    |   min   |   max   |    min   |    max   | min | max |                      Type                      |
    +---------+---------+----------+----------+-----+-----+------------------------------------------------+
    |       66|       66|  0.660 us|  0.660 us|   65|   65|  loop auto-rewind stp (delay=0 clock cycles(s))|
    +---------+---------+----------+----------+-----+-----+------------------------------------------------+

    + Detail: 
        * Instance: 
        N/A

        * Loop: 
        +-------------------+---------+---------+----------+-----------+-----------+------+----------+
        |                   |  Latency (cycles) | Iteration|  Initiation Interval  | Trip |          |
        |     Loop Name     |   min   |   max   |  Latency |  achieved |   target  | Count| Pipelined|
        +-------------------+---------+---------+----------+-----------+-----------+------+----------+
        |- VITIS_LOOP_48_5  |       64|       64|         2|          1|          1|    64|       yes|
        +-------------------+---------+---------+----------+-----------+-----------+------+----------+

============================================================
+ Verbose Summary: Synthesis Manager
============================================================
InlineROM: 1
ExposeGlobal: 0
============================================================
+ Verbose Summary: CDFG Model
============================================================
IsTopModel: 0
ResetActiveHigh: 1
IsCombinational: 0
IsDatapathOnly: 0
HasWiredReturn: 1
HasMFsm: 2
HasVarLatency: 1
IsPipeline: 0
IsRtlPipelined: 0
IsInstanceOverlapped: 0
IsDontTouch: 0
HasImplIP: 0
IsGatedGlobalClock: 0

+ Individual pipeline summary: 
  * Pipeline-0: initiation interval (II) = 1, depth = 2


============================================================
+ Verbose Summary: Schedule
============================================================
* Number of FSM states : 2
* Pipeline : 1
  Pipeline-0 : II = 1, D = 2, States = { 1 2 }
* Dataflow Pipeline: 0

* FSM state transitions: 
1 --> 2 
2 --> 

* FSM state operations: 

State 1 <SV = 0> <Delay = 2.82>
ST_1 : Operation 5 [1/1] (0.00ns)   --->   "%empty = alloca i32 1"   --->   Operation 5 'alloca' 'empty' <Predicate = true> <Delay = 0.00>
ST_1 : Operation 6 [1/1] (0.00ns)   --->   "%j = alloca i32 1" [top.cpp:48]   --->   Operation 6 'alloca' 'j' <Predicate = true> <Delay = 0.00>
ST_1 : Operation 7 [1/1] (0.00ns)   --->   "%zext_ln50_read = read i14 @_ssdm_op_Read.ap_auto.i14, i14 %zext_ln50"   --->   Operation 7 'read' 'zext_ln50_read' <Predicate = true> <Delay = 0.00>
ST_1 : Operation 8 [1/1] (0.48ns)   --->   "%store_ln48 = store i7 0, i7 %j" [top.cpp:48]   --->   Operation 8 'store' 'store_ln48' <Predicate = true> <Delay = 0.48>
ST_1 : Operation 9 [1/1] (0.48ns)   --->   "%store_ln0 = store i24 0, i24 %empty"   --->   Operation 9 'store' 'store_ln0' <Predicate = true> <Delay = 0.48>
ST_1 : Operation 10 [1/1] (0.00ns)   --->   "%br_ln0 = br void %for.body33"   --->   Operation 10 'br' 'br_ln0' <Predicate = true> <Delay = 0.00>
ST_1 : Operation 11 [1/1] (0.00ns)   --->   "%j_2 = load i7 %j" [top.cpp:48]   --->   Operation 11 'load' 'j_2' <Predicate = true> <Delay = 0.00>
ST_1 : Operation 12 [1/1] (0.89ns)   --->   "%icmp_ln48 = icmp_eq  i7 %j_2, i7 64" [top.cpp:48]   --->   Operation 12 'icmp' 'icmp_ln48' <Predicate = true> <Delay = 0.89> <CoreInst = "Cmp">   --->   Core 9 'Cmp' <Latency = 0> <II = 1> <Delay = 0.89> <FuncUnit> <Opcode : 'seteq' 'setne' 'setle' 'setge' 'setlt' 'setgt'> <InPorts = 2> <OutPorts = 1>
ST_1 : Operation 13 [1/1] (0.89ns)   --->   "%add_ln48 = add i7 %j_2, i7 1" [top.cpp:48]   --->   Operation 13 'add' 'add_ln48' <Predicate = true> <Delay = 0.89> <CoreInst = "Adder">   --->   Core 1 'Adder' <Latency = 0> <II = 1> <Delay = 0.89> <FuncUnit> <Opcode : 'add' 'sub'> <InPorts = 2> <OutPorts = 1>
ST_1 : Operation 14 [1/1] (0.00ns)   --->   "%br_ln48 = br i1 %icmp_ln48, void %for.body33.split, void %for.end42.exitStub" [top.cpp:48]   --->   Operation 14 'br' 'br_ln48' <Predicate = true> <Delay = 0.00>
ST_1 : Operation 15 [1/1] (0.00ns)   --->   "%zext_ln50_1 = zext i7 %j_2" [top.cpp:50]   --->   Operation 15 'zext' 'zext_ln50_1' <Predicate = (!icmp_ln48)> <Delay = 0.00>
ST_1 : Operation 16 [1/1] (0.98ns)   --->   "%add_ln50 = add i14 %zext_ln50_read, i14 %zext_ln50_1" [top.cpp:50]   --->   Operation 16 'add' 'add_ln50' <Predicate = (!icmp_ln48)> <Delay = 0.98> <CoreInst = "Adder">   --->   Core 1 'Adder' <Latency = 0> <II = 1> <Delay = 0.98> <FuncUnit> <Opcode : 'add' 'sub'> <InPorts = 2> <OutPorts = 1>
ST_1 : Operation 17 [1/1] (0.00ns)   --->   "%zext_ln50_2 = zext i14 %add_ln50" [top.cpp:50]   --->   Operation 17 'zext' 'zext_ln50_2' <Predicate = (!icmp_ln48)> <Delay = 0.00>
ST_1 : Operation 18 [1/1] (0.00ns)   --->   "%A_1_addr = getelementptr i24 %A_1, i64 0, i64 %zext_ln50_2" [top.cpp:50]   --->   Operation 18 'getelementptr' 'A_1_addr' <Predicate = (!icmp_ln48)> <Delay = 0.00>
ST_1 : Operation 19 [1/1] (0.00ns)   --->   "%trunc_ln48 = trunc i7 %j_2" [top.cpp:48]   --->   Operation 19 'trunc' 'trunc_ln48' <Predicate = (!icmp_ln48)> <Delay = 0.00>
ST_1 : Operation 20 [1/1] (0.00ns)   --->   "%lshr_ln = partselect i3 @_ssdm_op_PartSelect.i3.i7.i32.i32, i7 %j_2, i32 3, i32 5" [top.cpp:48]   --->   Operation 20 'partselect' 'lshr_ln' <Predicate = (!icmp_ln48)> <Delay = 0.00>
ST_1 : Operation 21 [2/2] (1.35ns)   --->   "%a = load i14 %A_1_addr" [top.cpp:50]   --->   Operation 21 'load' 'a' <Predicate = (!icmp_ln48)> <Delay = 1.35> <CoreInst = "RAM">   --->   Core 82 'RAM' <Latency = 1> <II = 1> <Delay = 1.35> <Storage> <Opcode : 'load' 'store'> <Ports = 2> <Width = 24> <Depth = 16384> <RAM>
ST_1 : Operation 22 [1/1] (0.74ns)   --->   "%switch_ln51 = switch i3 %trunc_ln48, void %arrayidx39.case.7, i3 0, void %arrayidx39.case.0, i3 1, void %arrayidx39.case.1, i3 2, void %arrayidx39.case.2, i3 3, void %arrayidx39.case.3, i3 4, void %arrayidx39.case.4, i3 5, void %arrayidx39.case.5, i3 6, void %arrayidx39.case.6" [top.cpp:51]   --->   Operation 22 'switch' 'switch_ln51' <Predicate = (!icmp_ln48)> <Delay = 0.74>
ST_1 : Operation 23 [1/1] (0.48ns)   --->   "%store_ln48 = store i7 %add_ln48, i7 %j" [top.cpp:48]   --->   Operation 23 'store' 'store_ln48' <Predicate = (!icmp_ln48)> <Delay = 0.48>
ST_1 : Operation 67 [1/1] (0.00ns)   --->   "%p_load6 = load i24 %empty"   --->   Operation 67 'load' 'p_load6' <Predicate = (icmp_ln48)> <Delay = 0.00>
ST_1 : Operation 68 [1/1] (0.00ns)   --->   "%write_ln0 = write void @_ssdm_op_Write.ap_auto.i24P0A, i24 %p_out, i24 %p_load6"   --->   Operation 68 'write' 'write_ln0' <Predicate = (icmp_ln48)> <Delay = 0.00>
ST_1 : Operation 69 [1/1] (0.48ns)   --->   "%ret_ln0 = ret"   --->   Operation 69 'ret' 'ret_ln0' <Predicate = (icmp_ln48)> <Delay = 0.48>

State 2 <SV = 1> <Delay = 3.38>
ST_2 : Operation 24 [1/1] (0.00ns)   --->   "%specpipeline_ln49 = specpipeline void @_ssdm_op_SpecPipeline, i32 1, i32 0, i32 0, i32 0, void @empty_11" [top.cpp:49]   --->   Operation 24 'specpipeline' 'specpipeline_ln49' <Predicate = true> <Delay = 0.00>
ST_2 : Operation 25 [1/1] (0.00ns)   --->   "%speclooptripcount_ln48 = speclooptripcount void @_ssdm_op_SpecLoopTripCount, i64 64, i64 64, i64 64" [top.cpp:48]   --->   Operation 25 'speclooptripcount' 'speclooptripcount_ln48' <Predicate = true> <Delay = 0.00>
ST_2 : Operation 26 [1/1] (0.00ns)   --->   "%specloopname_ln48 = specloopname void @_ssdm_op_SpecLoopName, void @empty_14" [top.cpp:48]   --->   Operation 26 'specloopname' 'specloopname_ln48' <Predicate = true> <Delay = 0.00>
ST_2 : Operation 27 [1/1] (0.00ns)   --->   "%zext_ln48 = zext i3 %lshr_ln" [top.cpp:48]   --->   Operation 27 'zext' 'zext_ln48' <Predicate = true> <Delay = 0.00>
ST_2 : Operation 28 [1/2] ( I:1.35ns O:1.35ns )   --->   "%a = load i14 %A_1_addr" [top.cpp:50]   --->   Operation 28 'load' 'a' <Predicate = true> <Delay = 1.35> <CoreInst = "RAM">   --->   Core 82 'RAM' <Latency = 1> <II = 1> <Delay = 1.35> <Storage> <Opcode : 'load' 'store'> <Ports = 2> <Width = 24> <Depth = 16384> <RAM>
ST_2 : Operation 29 [1/1] (0.00ns)   --->   "%row_buf_addr = getelementptr i24 %row_buf, i64 0, i64 %zext_ln48" [top.cpp:51]   --->   Operation 29 'getelementptr' 'row_buf_addr' <Predicate = true> <Delay = 0.00>
ST_2 : Operation 30 [1/1] (0.00ns)   --->   "%row_buf_1_addr = getelementptr i24 %row_buf_1, i64 0, i64 %zext_ln48" [top.cpp:51]   --->   Operation 30 'getelementptr' 'row_buf_1_addr' <Predicate = true> <Delay = 0.00>
ST_2 : Operation 31 [1/1] (0.00ns)   --->   "%row_buf_2_addr = getelementptr i24 %row_buf_2, i64 0, i64 %zext_ln48" [top.cpp:51]   --->   Operation 31 'getelementptr' 'row_buf_2_addr' <Predicate = true> <Delay = 0.00>
ST_2 : Operation 32 [1/1] (0.00ns)   --->   "%row_buf_3_addr = getelementptr i24 %row_buf_3, i64 0, i64 %zext_ln48" [top.cpp:51]   --->   Operation 32 'getelementptr' 'row_buf_3_addr' <Predicate = true> <Delay = 0.00>
ST_2 : Operation 33 [1/1] (0.00ns)   --->   "%row_buf_4_addr = getelementptr i24 %row_buf_4, i64 0, i64 %zext_ln48" [top.cpp:51]   --->   Operation 33 'getelementptr' 'row_buf_4_addr' <Predicate = true> <Delay = 0.00>
ST_2 : Operation 34 [1/1] (0.00ns)   --->   "%row_buf_5_addr = getelementptr i24 %row_buf_5, i64 0, i64 %zext_ln48" [top.cpp:51]   --->   Operation 34 'getelementptr' 'row_buf_5_addr' <Predicate = true> <Delay = 0.00>
ST_2 : Operation 35 [1/1] (0.00ns)   --->   "%row_buf_6_addr = getelementptr i24 %row_buf_6, i64 0, i64 %zext_ln48" [top.cpp:51]   --->   Operation 35 'getelementptr' 'row_buf_6_addr' <Predicate = true> <Delay = 0.00>
ST_2 : Operation 36 [1/1] (0.00ns)   --->   "%row_buf_7_addr = getelementptr i24 %row_buf_7, i64 0, i64 %zext_ln48" [top.cpp:51]   --->   Operation 36 'getelementptr' 'row_buf_7_addr' <Predicate = true> <Delay = 0.00>
ST_2 : Operation 37 [1/1] ( I:0.79ns O:0.79ns )   --->   "%store_ln51 = store i24 %a, i3 %row_buf_6_addr" [top.cpp:51]   --->   Operation 37 'store' 'store_ln51' <Predicate = (trunc_ln48 == 6)> <Delay = 0.79> <CoreInst = "RAM">   --->   Core 82 'RAM' <Latency = 1> <II = 1> <Delay = 0.79> <Storage> <Opcode : 'load' 'store'> <Ports = 2> <Width = 24> <Depth = 8> <RAM>
ST_2 : Operation 38 [1/1] (0.00ns)   --->   "%br_ln51 = br void %arrayidx39.exit" [top.cpp:51]   --->   Operation 38 'br' 'br_ln51' <Predicate = (trunc_ln48 == 6)> <Delay = 0.00>
ST_2 : Operation 39 [1/1] ( I:0.79ns O:0.79ns )   --->   "%store_ln51 = store i24 %a, i3 %row_buf_5_addr" [top.cpp:51]   --->   Operation 39 'store' 'store_ln51' <Predicate = (trunc_ln48 == 5)> <Delay = 0.79> <CoreInst = "RAM">   --->   Core 82 'RAM' <Latency = 1> <II = 1> <Delay = 0.79> <Storage> <Opcode : 'load' 'store'> <Ports = 2> <Width = 24> <Depth = 8> <RAM>
ST_2 : Operation 40 [1/1] (0.00ns)   --->   "%br_ln51 = br void %arrayidx39.exit" [top.cpp:51]   --->   Operation 40 'br' 'br_ln51' <Predicate = (trunc_ln48 == 5)> <Delay = 0.00>
ST_2 : Operation 41 [1/1] ( I:0.79ns O:0.79ns )   --->   "%store_ln51 = store i24 %a, i3 %row_buf_4_addr" [top.cpp:51]   --->   Operation 41 'store' 'store_ln51' <Predicate = (trunc_ln48 == 4)> <Delay = 0.79> <CoreInst = "RAM">   --->   Core 82 'RAM' <Latency = 1> <II = 1> <Delay = 0.79> <Storage> <Opcode : 'load' 'store'> <Ports = 2> <Width = 24> <Depth = 8> <RAM>
ST_2 : Operation 42 [1/1] (0.00ns)   --->   "%br_ln51 = br void %arrayidx39.exit" [top.cpp:51]   --->   Operation 42 'br' 'br_ln51' <Predicate = (trunc_ln48 == 4)> <Delay = 0.00>
ST_2 : Operation 43 [1/1] ( I:0.79ns O:0.79ns )   --->   "%store_ln51 = store i24 %a, i3 %row_buf_3_addr" [top.cpp:51]   --->   Operation 43 'store' 'store_ln51' <Predicate = (trunc_ln48 == 3)> <Delay = 0.79> <CoreInst = "RAM">   --->   Core 82 'RAM' <Latency = 1> <II = 1> <Delay = 0.79> <Storage> <Opcode : 'load' 'store'> <Ports = 2> <Width = 24> <Depth = 8> <RAM>
ST_2 : Operation 44 [1/1] (0.00ns)   --->   "%br_ln51 = br void %arrayidx39.exit" [top.cpp:51]   --->   Operation 44 'br' 'br_ln51' <Predicate = (trunc_ln48 == 3)> <Delay = 0.00>
ST_2 : Operation 45 [1/1] ( I:0.79ns O:0.79ns )   --->   "%store_ln51 = store i24 %a, i3 %row_buf_2_addr" [top.cpp:51]   --->   Operation 45 'store' 'store_ln51' <Predicate = (trunc_ln48 == 2)> <Delay = 0.79> <CoreInst = "RAM">   --->   Core 82 'RAM' <Latency = 1> <II = 1> <Delay = 0.79> <Storage> <Opcode : 'load' 'store'> <Ports = 2> <Width = 24> <Depth = 8> <RAM>
ST_2 : Operation 46 [1/1] (0.00ns)   --->   "%br_ln51 = br void %arrayidx39.exit" [top.cpp:51]   --->   Operation 46 'br' 'br_ln51' <Predicate = (trunc_ln48 == 2)> <Delay = 0.00>
ST_2 : Operation 47 [1/1] ( I:0.79ns O:0.79ns )   --->   "%store_ln51 = store i24 %a, i3 %row_buf_1_addr" [top.cpp:51]   --->   Operation 47 'store' 'store_ln51' <Predicate = (trunc_ln48 == 1)> <Delay = 0.79> <CoreInst = "RAM">   --->   Core 82 'RAM' <Latency = 1> <II = 1> <Delay = 0.79> <Storage> <Opcode : 'load' 'store'> <Ports = 2> <Width = 24> <Depth = 8> <RAM>
ST_2 : Operation 48 [1/1] (0.00ns)   --->   "%br_ln51 = br void %arrayidx39.exit" [top.cpp:51]   --->   Operation 48 'br' 'br_ln51' <Predicate = (trunc_ln48 == 1)> <Delay = 0.00>
ST_2 : Operation 49 [1/1] ( I:0.79ns O:0.79ns )   --->   "%store_ln51 = store i24 %a, i3 %row_buf_addr" [top.cpp:51]   --->   Operation 49 'store' 'store_ln51' <Predicate = (trunc_ln48 == 0)> <Delay = 0.79> <CoreInst = "RAM">   --->   Core 82 'RAM' <Latency = 1> <II = 1> <Delay = 0.79> <Storage> <Opcode : 'load' 'store'> <Ports = 2> <Width = 24> <Depth = 8> <RAM>
ST_2 : Operation 50 [1/1] (0.00ns)   --->   "%br_ln51 = br void %arrayidx39.exit" [top.cpp:51]   --->   Operation 50 'br' 'br_ln51' <Predicate = (trunc_ln48 == 0)> <Delay = 0.00>
ST_2 : Operation 51 [1/1] ( I:0.79ns O:0.79ns )   --->   "%store_ln51 = store i24 %a, i3 %row_buf_7_addr" [top.cpp:51]   --->   Operation 51 'store' 'store_ln51' <Predicate = (trunc_ln48 == 7)> <Delay = 0.79> <CoreInst = "RAM">   --->   Core 82 'RAM' <Latency = 1> <II = 1> <Delay = 0.79> <Storage> <Opcode : 'load' 'store'> <Ports = 2> <Width = 24> <Depth = 8> <RAM>
ST_2 : Operation 52 [1/1] (0.00ns)   --->   "%br_ln51 = br void %arrayidx39.exit" [top.cpp:51]   --->   Operation 52 'br' 'br_ln51' <Predicate = (trunc_ln48 == 7)> <Delay = 0.00>
ST_2 : Operation 53 [1/1] (0.00ns)   --->   "%p_load = load i24 %empty" [top.cpp:52]   --->   Operation 53 'load' 'p_load' <Predicate = true> <Delay = 0.00>
ST_2 : Operation 54 [1/1] (0.00ns)   --->   "%sext_ln52 = sext i24 %p_load" [top.cpp:52]   --->   Operation 54 'sext' 'sext_ln52' <Predicate = true> <Delay = 0.00>
ST_2 : Operation 55 [1/1] (0.00ns)   --->   "%sext_ln52_1 = sext i24 %a" [top.cpp:52]   --->   Operation 55 'sext' 'sext_ln52_1' <Predicate = true> <Delay = 0.00>
ST_2 : Operation 56 [1/1] (1.10ns)   --->   "%add_ln52 = add i24 %a, i24 %p_load" [top.cpp:52]   --->   Operation 56 'add' 'add_ln52' <Predicate = true> <Delay = 1.10> <CoreInst = "Adder">   --->   Core 1 'Adder' <Latency = 0> <II = 1> <Delay = 1.10> <FuncUnit> <Opcode : 'add' 'sub'> <InPorts = 2> <OutPorts = 1>
ST_2 : Operation 57 [1/1] (1.10ns)   --->   "%add_ln52_1 = add i25 %sext_ln52_1, i25 %sext_ln52" [top.cpp:52]   --->   Operation 57 'add' 'add_ln52_1' <Predicate = true> <Delay = 1.10> <CoreInst = "Adder">   --->   Core 1 'Adder' <Latency = 0> <II = 1> <Delay = 1.10> <FuncUnit> <Opcode : 'add' 'sub'> <InPorts = 2> <OutPorts = 1>
ST_2 : Operation 58 [1/1] (0.00ns)   --->   "%tmp = bitselect i1 @_ssdm_op_BitSelect.i1.i25.i32, i25 %add_ln52_1, i32 24" [top.cpp:52]   --->   Operation 58 'bitselect' 'tmp' <Predicate = true> <Delay = 0.00>
ST_2 : Operation 59 [1/1] (0.00ns)   --->   "%tmp_112 = bitselect i1 @_ssdm_op_BitSelect.i1.i24.i32, i24 %add_ln52, i32 23" [top.cpp:52]   --->   Operation 59 'bitselect' 'tmp_112' <Predicate = true> <Delay = 0.00>
ST_2 : Operation 60 [1/1] (0.00ns) (grouped into LUT with out node select_ln52_1)   --->   "%xor_ln52 = xor i1 %tmp, i1 1" [top.cpp:52]   --->   Operation 60 'xor' 'xor_ln52' <Predicate = true> <Delay = 0.00> <CoreInst = "LogicGate">   --->   Core 74 'LogicGate' <Latency = 0> <II = 1> <Delay = 0.33> <FuncUnit> <Opcode : 'and' 'or' 'xor'> <InPorts = 2> <OutPorts = 1>
ST_2 : Operation 61 [1/1] (0.00ns) (grouped into LUT with out node select_ln52_1)   --->   "%and_ln52 = and i1 %tmp_112, i1 %xor_ln52" [top.cpp:52]   --->   Operation 61 'and' 'and_ln52' <Predicate = true> <Delay = 0.00> <CoreInst = "LogicGate">   --->   Core 74 'LogicGate' <Latency = 0> <II = 1> <Delay = 0.33> <FuncUnit> <Opcode : 'and' 'or' 'xor'> <InPorts = 2> <OutPorts = 1>
ST_2 : Operation 62 [1/1] (0.00ns) (grouped into LUT with out node select_ln52_1)   --->   "%xor_ln52_1 = xor i1 %tmp, i1 %tmp_112" [top.cpp:52]   --->   Operation 62 'xor' 'xor_ln52_1' <Predicate = true> <Delay = 0.00> <CoreInst = "LogicGate">   --->   Core 74 'LogicGate' <Latency = 0> <II = 1> <Delay = 0.33> <FuncUnit> <Opcode : 'and' 'or' 'xor'> <InPorts = 2> <OutPorts = 1>
ST_2 : Operation 63 [1/1] (0.00ns) (grouped into LUT with out node select_ln52_1)   --->   "%select_ln52 = select i1 %and_ln52, i24 8388607, i24 8388608" [top.cpp:52]   --->   Operation 63 'select' 'select_ln52' <Predicate = true> <Delay = 0.00> <CoreInst = "Sel">   --->   Core 73 'Sel' <Latency = 0> <II = 1> <Delay = 0.43> <FuncUnit> <Opcode : 'select'> <InPorts = 3> <OutPorts = 1>
ST_2 : Operation 64 [1/1] (0.43ns) (out node of the LUT)   --->   "%select_ln52_1 = select i1 %xor_ln52_1, i24 %select_ln52, i24 %add_ln52" [top.cpp:52]   --->   Operation 64 'select' 'select_ln52_1' <Predicate = true> <Delay = 0.43> <CoreInst = "Sel">   --->   Core 73 'Sel' <Latency = 0> <II = 1> <Delay = 0.43> <FuncUnit> <Opcode : 'select'> <InPorts = 3> <OutPorts = 1>
ST_2 : Operation 65 [1/1] (0.48ns)   --->   "%store_ln52 = store i24 %select_ln52_1, i24 %empty" [top.cpp:52]   --->   Operation 65 'store' 'store_ln52' <Predicate = true> <Delay = 0.48>
ST_2 : Operation 66 [1/1] (0.00ns)   --->   "%br_ln48 = br void %for.body33" [top.cpp:48]   --->   Operation 66 'br' 'br_ln48' <Predicate = true> <Delay = 0.00>


============================================================
+ Verbose Summary: Timing violations
============================================================
Target clock period: 10.000ns, clock uncertainty: 2.700ns.

 <State 1>: 2.830ns
The critical path consists of the following:
	'store' operation 0 bit ('store_ln48', top.cpp:48) of constant 0 on local variable 'j', top.cpp:48 [15]  (0.489 ns)
	'load' operation 7 bit ('j', top.cpp:48) on local variable 'j', top.cpp:48 [19]  (0.000 ns)
	'add' operation 14 bit ('add_ln50', top.cpp:50) [25]  (0.989 ns)
	'getelementptr' operation 14 bit ('A_1_addr', top.cpp:50) [27]  (0.000 ns)
	'load' operation 24 bit ('a', top.cpp:50) on array 'A_1' [34]  (1.352 ns)

 <State 2>: 3.385ns
The critical path consists of the following:
	'load' operation 24 bit ('a', top.cpp:50) on array 'A_1' [34]  (1.352 ns)
	'add' operation 24 bit ('add_ln52', top.cpp:52) [72]  (1.110 ns)
	'select' operation 24 bit ('select_ln52_1', top.cpp:52) [80]  (0.435 ns)
	'store' operation 0 bit ('store_ln52', top.cpp:52) of variable 'select_ln52_1', top.cpp:52 on local variable 'empty' [82]  (0.489 ns)


============================================================
+ Verbose Summary: Binding
============================================================
N/A
* FSMD analyzer results:
  - Output states:
 - Input state : 
  - Chain level:
	State 1
	State 2


============================================================
+ Verbose Summary: Datapath Resource usage 
============================================================
N/A
