

================================================================
== Vitis HLS Report for 'top_kernel_Pipeline_VITIS_LOOP_67_5'
================================================================
* Date:           Sat Jan 31 19:51:25 2026

* Version:        2025.1.1 (Build 6214317 on Sep 11 2025)
* Project:        project_1
* Solution:       hls (Vivado IP Flow Target)
* Product family: zynquplus
* Target device:  xczu3eg-sbva484-1-e


================================================================
== Performance Estimates
================================================================
+ Timing: 
    * Summary: 
    +--------+----------+----------+------------+
    |  Clock |  Target  | Estimated| Uncertainty|
    +--------+----------+----------+------------+
    |ap_clk  |  10.00 ns|  3.385 ns|     2.70 ns|
    +--------+----------+----------+------------+

+ Latency: 
    * Summary: 
    +---------+---------+----------+----------+-----+-----+------------------------------------------------+
    |  Latency (cycles) |  Latency (absolute) |  Interval |                    Pipeline                    |
    |   min   |   max   |    min   |    max   | min | max |                      Type                      |
    +---------+---------+----------+----------+-----+-----+------------------------------------------------+
    |       66|       66|  0.660 us|  0.660 us|   65|   65|  loop auto-rewind stp (delay=0 clock cycles(s))|
    +---------+---------+----------+----------+-----+-----+------------------------------------------------+

    + Detail: 
        * Instance: 
        N/A

        * Loop: 
        +-------------------+---------+---------+----------+-----------+-----------+------+----------+
        |                   |  Latency (cycles) | Iteration|  Initiation Interval  | Trip |          |
        |     Loop Name     |   min   |   max   |  Latency |  achieved |   target  | Count| Pipelined|
        +-------------------+---------+---------+----------+-----------+-----------+------+----------+
        |- VITIS_LOOP_67_5  |       64|       64|         2|          1|          1|    64|       yes|
        +-------------------+---------+---------+----------+-----------+-----------+------+----------+

============================================================
+ Verbose Summary: Synthesis Manager
============================================================
InlineROM: 1
ExposeGlobal: 0
============================================================
+ Verbose Summary: CDFG Model
============================================================
IsTopModel: 0
ResetActiveHigh: 1
IsCombinational: 0
IsDatapathOnly: 0
HasWiredReturn: 1
HasMFsm: 2
HasVarLatency: 1
IsPipeline: 0
IsRtlPipelined: 0
IsInstanceOverlapped: 0
IsDontTouch: 0
HasImplIP: 0
IsGatedGlobalClock: 0

+ Individual pipeline summary: 
  * Pipeline-0: initiation interval (II) = 1, depth = 2


============================================================
+ Verbose Summary: Schedule
============================================================
* Number of FSM states : 2
* Pipeline : 1
  Pipeline-0 : II = 1, D = 2, States = { 1 2 }
* Dataflow Pipeline: 0

* FSM state transitions: 
1 --> 2 
2 --> 

* FSM state operations: 

State 1 <SV = 0> <Delay = 2.82>
ST_1 : Operation 5 [1/1] (0.00ns)   --->   "%empty = alloca i32 1"   --->   Operation 5 'alloca' 'empty' <Predicate = true> <Delay = 0.00>
ST_1 : Operation 6 [1/1] (0.00ns)   --->   "%j_2 = alloca i32 1" [top.cpp:67]   --->   Operation 6 'alloca' 'j_2' <Predicate = true> <Delay = 0.00>
ST_1 : Operation 7 [1/1] (0.00ns)   --->   "%zext_ln69_read = read i14 @_ssdm_op_Read.ap_auto.i14, i14 %zext_ln69"   --->   Operation 7 'read' 'zext_ln69_read' <Predicate = true> <Delay = 0.00>
ST_1 : Operation 8 [1/1] (0.48ns)   --->   "%store_ln67 = store i7 0, i7 %j_2" [top.cpp:67]   --->   Operation 8 'store' 'store_ln67' <Predicate = true> <Delay = 0.48>
ST_1 : Operation 9 [1/1] (0.48ns)   --->   "%store_ln0 = store i24 0, i24 %empty"   --->   Operation 9 'store' 'store_ln0' <Predicate = true> <Delay = 0.48>
ST_1 : Operation 10 [1/1] (0.00ns)   --->   "%br_ln0 = br void %for.body33"   --->   Operation 10 'br' 'br_ln0' <Predicate = true> <Delay = 0.00>
ST_1 : Operation 11 [1/1] (0.00ns)   --->   "%j = load i7 %j_2" [top.cpp:67]   --->   Operation 11 'load' 'j' <Predicate = true> <Delay = 0.00>
ST_1 : Operation 12 [1/1] (0.89ns)   --->   "%icmp_ln67 = icmp_eq  i7 %j, i7 64" [top.cpp:67]   --->   Operation 12 'icmp' 'icmp_ln67' <Predicate = true> <Delay = 0.89> <CoreInst = "Cmp">   --->   Core 9 'Cmp' <Latency = 0> <II = 1> <Delay = 0.89> <FuncUnit> <Opcode : 'seteq' 'setne' 'setle' 'setge' 'setlt' 'setgt'> <InPorts = 2> <OutPorts = 1>
ST_1 : Operation 13 [1/1] (0.89ns)   --->   "%add_ln67 = add i7 %j, i7 1" [top.cpp:67]   --->   Operation 13 'add' 'add_ln67' <Predicate = true> <Delay = 0.89> <CoreInst = "Adder">   --->   Core 1 'Adder' <Latency = 0> <II = 1> <Delay = 0.89> <FuncUnit> <Opcode : 'add' 'sub'> <InPorts = 2> <OutPorts = 1>
ST_1 : Operation 14 [1/1] (0.00ns)   --->   "%br_ln67 = br i1 %icmp_ln67, void %for.body33.split, void %for.end42.exitStub" [top.cpp:67]   --->   Operation 14 'br' 'br_ln67' <Predicate = true> <Delay = 0.00>
ST_1 : Operation 15 [1/1] (0.00ns)   --->   "%zext_ln69_1 = zext i7 %j" [top.cpp:69]   --->   Operation 15 'zext' 'zext_ln69_1' <Predicate = (!icmp_ln67)> <Delay = 0.00>
ST_1 : Operation 16 [1/1] (0.98ns)   --->   "%add_ln69 = add i14 %zext_ln69_read, i14 %zext_ln69_1" [top.cpp:69]   --->   Operation 16 'add' 'add_ln69' <Predicate = (!icmp_ln67)> <Delay = 0.98> <CoreInst = "Adder">   --->   Core 1 'Adder' <Latency = 0> <II = 1> <Delay = 0.98> <FuncUnit> <Opcode : 'add' 'sub'> <InPorts = 2> <OutPorts = 1>
ST_1 : Operation 17 [1/1] (0.00ns)   --->   "%zext_ln69_2 = zext i14 %add_ln69" [top.cpp:69]   --->   Operation 17 'zext' 'zext_ln69_2' <Predicate = (!icmp_ln67)> <Delay = 0.00>
ST_1 : Operation 18 [1/1] (0.00ns)   --->   "%A_1_addr = getelementptr i24 %A_1, i64 0, i64 %zext_ln69_2" [top.cpp:69]   --->   Operation 18 'getelementptr' 'A_1_addr' <Predicate = (!icmp_ln67)> <Delay = 0.00>
ST_1 : Operation 19 [1/1] (0.00ns)   --->   "%trunc_ln67 = trunc i7 %j" [top.cpp:67]   --->   Operation 19 'trunc' 'trunc_ln67' <Predicate = (!icmp_ln67)> <Delay = 0.00>
ST_1 : Operation 20 [1/1] (0.00ns)   --->   "%lshr_ln = partselect i4 @_ssdm_op_PartSelect.i4.i7.i32.i32, i7 %j, i32 2, i32 5" [top.cpp:67]   --->   Operation 20 'partselect' 'lshr_ln' <Predicate = (!icmp_ln67)> <Delay = 0.00>
ST_1 : Operation 21 [2/2] (1.35ns)   --->   "%a = load i14 %A_1_addr" [top.cpp:69]   --->   Operation 21 'load' 'a' <Predicate = (!icmp_ln67)> <Delay = 1.35> <CoreInst = "RAM">   --->   Core 82 'RAM' <Latency = 1> <II = 1> <Delay = 1.35> <Storage> <Opcode : 'load' 'store'> <Ports = 2> <Width = 24> <Depth = 16384> <RAM>
ST_1 : Operation 22 [1/1] (0.62ns)   --->   "%switch_ln70 = switch i2 %trunc_ln67, void %arrayidx39.case.3, i2 0, void %arrayidx39.case.0, i2 1, void %arrayidx39.case.1, i2 2, void %arrayidx39.case.2" [top.cpp:70]   --->   Operation 22 'switch' 'switch_ln70' <Predicate = (!icmp_ln67)> <Delay = 0.62>
ST_1 : Operation 23 [1/1] (0.48ns)   --->   "%store_ln67 = store i7 %add_ln67, i7 %j_2" [top.cpp:67]   --->   Operation 23 'store' 'store_ln67' <Predicate = (!icmp_ln67)> <Delay = 0.48>
ST_1 : Operation 55 [1/1] (0.00ns)   --->   "%p_load6 = load i24 %empty"   --->   Operation 55 'load' 'p_load6' <Predicate = (icmp_ln67)> <Delay = 0.00>
ST_1 : Operation 56 [1/1] (0.00ns)   --->   "%write_ln0 = write void @_ssdm_op_Write.ap_auto.i24P0A, i24 %p_out, i24 %p_load6"   --->   Operation 56 'write' 'write_ln0' <Predicate = (icmp_ln67)> <Delay = 0.00>
ST_1 : Operation 57 [1/1] (0.48ns)   --->   "%ret_ln0 = ret"   --->   Operation 57 'ret' 'ret_ln0' <Predicate = (icmp_ln67)> <Delay = 0.48>

State 2 <SV = 1> <Delay = 3.38>
ST_2 : Operation 24 [1/1] (0.00ns)   --->   "%specpipeline_ln68 = specpipeline void @_ssdm_op_SpecPipeline, i32 1, i32 0, i32 0, i32 0, void @empty_0" [top.cpp:68]   --->   Operation 24 'specpipeline' 'specpipeline_ln68' <Predicate = true> <Delay = 0.00>
ST_2 : Operation 25 [1/1] (0.00ns)   --->   "%speclooptripcount_ln67 = speclooptripcount void @_ssdm_op_SpecLoopTripCount, i64 64, i64 64, i64 64" [top.cpp:67]   --->   Operation 25 'speclooptripcount' 'speclooptripcount_ln67' <Predicate = true> <Delay = 0.00>
ST_2 : Operation 26 [1/1] (0.00ns)   --->   "%specloopname_ln67 = specloopname void @_ssdm_op_SpecLoopName, void @empty_4" [top.cpp:67]   --->   Operation 26 'specloopname' 'specloopname_ln67' <Predicate = true> <Delay = 0.00>
ST_2 : Operation 27 [1/1] (0.00ns)   --->   "%zext_ln67 = zext i4 %lshr_ln" [top.cpp:67]   --->   Operation 27 'zext' 'zext_ln67' <Predicate = true> <Delay = 0.00>
ST_2 : Operation 28 [1/2] ( I:1.35ns O:1.35ns )   --->   "%a = load i14 %A_1_addr" [top.cpp:69]   --->   Operation 28 'load' 'a' <Predicate = true> <Delay = 1.35> <CoreInst = "RAM">   --->   Core 82 'RAM' <Latency = 1> <II = 1> <Delay = 1.35> <Storage> <Opcode : 'load' 'store'> <Ports = 2> <Width = 24> <Depth = 16384> <RAM>
ST_2 : Operation 29 [1/1] (0.00ns)   --->   "%row_buf_addr = getelementptr i24 %row_buf, i64 0, i64 %zext_ln67" [top.cpp:70]   --->   Operation 29 'getelementptr' 'row_buf_addr' <Predicate = true> <Delay = 0.00>
ST_2 : Operation 30 [1/1] (0.00ns)   --->   "%row_buf_1_addr = getelementptr i24 %row_buf_1, i64 0, i64 %zext_ln67" [top.cpp:70]   --->   Operation 30 'getelementptr' 'row_buf_1_addr' <Predicate = true> <Delay = 0.00>
ST_2 : Operation 31 [1/1] (0.00ns)   --->   "%row_buf_2_addr = getelementptr i24 %row_buf_2, i64 0, i64 %zext_ln67" [top.cpp:70]   --->   Operation 31 'getelementptr' 'row_buf_2_addr' <Predicate = true> <Delay = 0.00>
ST_2 : Operation 32 [1/1] (0.00ns)   --->   "%row_buf_3_addr = getelementptr i24 %row_buf_3, i64 0, i64 %zext_ln67" [top.cpp:70]   --->   Operation 32 'getelementptr' 'row_buf_3_addr' <Predicate = true> <Delay = 0.00>
ST_2 : Operation 33 [1/1] ( I:0.79ns O:0.79ns )   --->   "%store_ln70 = store i24 %a, i4 %row_buf_2_addr" [top.cpp:70]   --->   Operation 33 'store' 'store_ln70' <Predicate = (trunc_ln67 == 2)> <Delay = 0.79> <CoreInst = "RAM">   --->   Core 82 'RAM' <Latency = 1> <II = 1> <Delay = 0.79> <Storage> <Opcode : 'load' 'store'> <Ports = 2> <Width = 24> <Depth = 16> <RAM>
ST_2 : Operation 34 [1/1] (0.00ns)   --->   "%br_ln70 = br void %arrayidx39.exit" [top.cpp:70]   --->   Operation 34 'br' 'br_ln70' <Predicate = (trunc_ln67 == 2)> <Delay = 0.00>
ST_2 : Operation 35 [1/1] ( I:0.79ns O:0.79ns )   --->   "%store_ln70 = store i24 %a, i4 %row_buf_1_addr" [top.cpp:70]   --->   Operation 35 'store' 'store_ln70' <Predicate = (trunc_ln67 == 1)> <Delay = 0.79> <CoreInst = "RAM">   --->   Core 82 'RAM' <Latency = 1> <II = 1> <Delay = 0.79> <Storage> <Opcode : 'load' 'store'> <Ports = 2> <Width = 24> <Depth = 16> <RAM>
ST_2 : Operation 36 [1/1] (0.00ns)   --->   "%br_ln70 = br void %arrayidx39.exit" [top.cpp:70]   --->   Operation 36 'br' 'br_ln70' <Predicate = (trunc_ln67 == 1)> <Delay = 0.00>
ST_2 : Operation 37 [1/1] ( I:0.79ns O:0.79ns )   --->   "%store_ln70 = store i24 %a, i4 %row_buf_addr" [top.cpp:70]   --->   Operation 37 'store' 'store_ln70' <Predicate = (trunc_ln67 == 0)> <Delay = 0.79> <CoreInst = "RAM">   --->   Core 82 'RAM' <Latency = 1> <II = 1> <Delay = 0.79> <Storage> <Opcode : 'load' 'store'> <Ports = 2> <Width = 24> <Depth = 16> <RAM>
ST_2 : Operation 38 [1/1] (0.00ns)   --->   "%br_ln70 = br void %arrayidx39.exit" [top.cpp:70]   --->   Operation 38 'br' 'br_ln70' <Predicate = (trunc_ln67 == 0)> <Delay = 0.00>
ST_2 : Operation 39 [1/1] ( I:0.79ns O:0.79ns )   --->   "%store_ln70 = store i24 %a, i4 %row_buf_3_addr" [top.cpp:70]   --->   Operation 39 'store' 'store_ln70' <Predicate = (trunc_ln67 == 3)> <Delay = 0.79> <CoreInst = "RAM">   --->   Core 82 'RAM' <Latency = 1> <II = 1> <Delay = 0.79> <Storage> <Opcode : 'load' 'store'> <Ports = 2> <Width = 24> <Depth = 16> <RAM>
ST_2 : Operation 40 [1/1] (0.00ns)   --->   "%br_ln70 = br void %arrayidx39.exit" [top.cpp:70]   --->   Operation 40 'br' 'br_ln70' <Predicate = (trunc_ln67 == 3)> <Delay = 0.00>
ST_2 : Operation 41 [1/1] (0.00ns)   --->   "%p_load = load i24 %empty" [top.cpp:71]   --->   Operation 41 'load' 'p_load' <Predicate = true> <Delay = 0.00>
ST_2 : Operation 42 [1/1] (0.00ns)   --->   "%sext_ln71 = sext i24 %p_load" [top.cpp:71]   --->   Operation 42 'sext' 'sext_ln71' <Predicate = true> <Delay = 0.00>
ST_2 : Operation 43 [1/1] (0.00ns)   --->   "%sext_ln71_1 = sext i24 %a" [top.cpp:71]   --->   Operation 43 'sext' 'sext_ln71_1' <Predicate = true> <Delay = 0.00>
ST_2 : Operation 44 [1/1] (1.10ns)   --->   "%add_ln71 = add i24 %a, i24 %p_load" [top.cpp:71]   --->   Operation 44 'add' 'add_ln71' <Predicate = true> <Delay = 1.10> <CoreInst = "Adder">   --->   Core 1 'Adder' <Latency = 0> <II = 1> <Delay = 1.10> <FuncUnit> <Opcode : 'add' 'sub'> <InPorts = 2> <OutPorts = 1>
ST_2 : Operation 45 [1/1] (1.10ns)   --->   "%add_ln71_1 = add i25 %sext_ln71_1, i25 %sext_ln71" [top.cpp:71]   --->   Operation 45 'add' 'add_ln71_1' <Predicate = true> <Delay = 1.10> <CoreInst = "Adder">   --->   Core 1 'Adder' <Latency = 0> <II = 1> <Delay = 1.10> <FuncUnit> <Opcode : 'add' 'sub'> <InPorts = 2> <OutPorts = 1>
ST_2 : Operation 46 [1/1] (0.00ns)   --->   "%tmp = bitselect i1 @_ssdm_op_BitSelect.i1.i25.i32, i25 %add_ln71_1, i32 24" [top.cpp:71]   --->   Operation 46 'bitselect' 'tmp' <Predicate = true> <Delay = 0.00>
ST_2 : Operation 47 [1/1] (0.00ns)   --->   "%tmp_37 = bitselect i1 @_ssdm_op_BitSelect.i1.i24.i32, i24 %add_ln71, i32 23" [top.cpp:71]   --->   Operation 47 'bitselect' 'tmp_37' <Predicate = true> <Delay = 0.00>
ST_2 : Operation 48 [1/1] (0.00ns) (grouped into LUT with out node select_ln71_1)   --->   "%xor_ln71 = xor i1 %tmp, i1 1" [top.cpp:71]   --->   Operation 48 'xor' 'xor_ln71' <Predicate = true> <Delay = 0.00> <CoreInst = "LogicGate">   --->   Core 74 'LogicGate' <Latency = 0> <II = 1> <Delay = 0.33> <FuncUnit> <Opcode : 'and' 'or' 'xor'> <InPorts = 2> <OutPorts = 1>
ST_2 : Operation 49 [1/1] (0.00ns) (grouped into LUT with out node select_ln71_1)   --->   "%and_ln71 = and i1 %tmp_37, i1 %xor_ln71" [top.cpp:71]   --->   Operation 49 'and' 'and_ln71' <Predicate = true> <Delay = 0.00> <CoreInst = "LogicGate">   --->   Core 74 'LogicGate' <Latency = 0> <II = 1> <Delay = 0.33> <FuncUnit> <Opcode : 'and' 'or' 'xor'> <InPorts = 2> <OutPorts = 1>
ST_2 : Operation 50 [1/1] (0.00ns) (grouped into LUT with out node select_ln71_1)   --->   "%xor_ln71_1 = xor i1 %tmp, i1 %tmp_37" [top.cpp:71]   --->   Operation 50 'xor' 'xor_ln71_1' <Predicate = true> <Delay = 0.00> <CoreInst = "LogicGate">   --->   Core 74 'LogicGate' <Latency = 0> <II = 1> <Delay = 0.33> <FuncUnit> <Opcode : 'and' 'or' 'xor'> <InPorts = 2> <OutPorts = 1>
ST_2 : Operation 51 [1/1] (0.00ns) (grouped into LUT with out node select_ln71_1)   --->   "%select_ln71 = select i1 %and_ln71, i24 8388607, i24 8388608" [top.cpp:71]   --->   Operation 51 'select' 'select_ln71' <Predicate = true> <Delay = 0.00> <CoreInst = "Sel">   --->   Core 73 'Sel' <Latency = 0> <II = 1> <Delay = 0.43> <FuncUnit> <Opcode : 'select'> <InPorts = 3> <OutPorts = 1>
ST_2 : Operation 52 [1/1] (0.43ns) (out node of the LUT)   --->   "%select_ln71_1 = select i1 %xor_ln71_1, i24 %select_ln71, i24 %add_ln71" [top.cpp:71]   --->   Operation 52 'select' 'select_ln71_1' <Predicate = true> <Delay = 0.43> <CoreInst = "Sel">   --->   Core 73 'Sel' <Latency = 0> <II = 1> <Delay = 0.43> <FuncUnit> <Opcode : 'select'> <InPorts = 3> <OutPorts = 1>
ST_2 : Operation 53 [1/1] (0.48ns)   --->   "%store_ln71 = store i24 %select_ln71_1, i24 %empty" [top.cpp:71]   --->   Operation 53 'store' 'store_ln71' <Predicate = true> <Delay = 0.48>
ST_2 : Operation 54 [1/1] (0.00ns)   --->   "%br_ln67 = br void %for.body33" [top.cpp:67]   --->   Operation 54 'br' 'br_ln67' <Predicate = true> <Delay = 0.00>


============================================================
+ Verbose Summary: Timing violations
============================================================
Target clock period: 10.000ns, clock uncertainty: 2.700ns.

 <State 1>: 2.830ns
The critical path consists of the following:
	'store' operation 0 bit ('store_ln67', top.cpp:67) of constant 0 on local variable 'j', top.cpp:67 [11]  (0.489 ns)
	'load' operation 7 bit ('j', top.cpp:67) on local variable 'j', top.cpp:67 [15]  (0.000 ns)
	'add' operation 14 bit ('add_ln69', top.cpp:69) [21]  (0.989 ns)
	'getelementptr' operation 14 bit ('A_1_addr', top.cpp:69) [23]  (0.000 ns)
	'load' operation 24 bit ('a', top.cpp:69) on array 'A_1' [30]  (1.352 ns)

 <State 2>: 3.385ns
The critical path consists of the following:
	'load' operation 24 bit ('a', top.cpp:69) on array 'A_1' [30]  (1.352 ns)
	'add' operation 24 bit ('add_ln71', top.cpp:71) [52]  (1.110 ns)
	'select' operation 24 bit ('select_ln71_1', top.cpp:71) [60]  (0.435 ns)
	'store' operation 0 bit ('store_ln71', top.cpp:71) of variable 'select_ln71_1', top.cpp:71 on local variable 'empty' [62]  (0.489 ns)


============================================================
+ Verbose Summary: Binding
============================================================
N/A
* FSMD analyzer results:
  - Output states:
 - Input state : 
  - Chain level:
	State 1
	State 2


============================================================
+ Verbose Summary: Datapath Resource usage 
============================================================
N/A
