

================================================================
== Vitis HLS Report for 'top_kernel_Pipeline_VITIS_LOOP_104_10_VITIS_LOOP_105_11'
================================================================
* Date:           Sat Jan 31 21:11:32 2026

* Version:        2025.1.1 (Build 6214317 on Sep 11 2025)
* Project:        project_1
* Solution:       hls (Vivado IP Flow Target)
* Product family: zynquplus
* Target device:  xczu3eg-sbva484-1-e


================================================================
== Performance Estimates
================================================================
+ Timing: 
    * Summary: 
    +--------+----------+----------+------------+
    |  Clock |  Target  | Estimated| Uncertainty|
    +--------+----------+----------+------------+
    |ap_clk  |  10.00 ns|  7.300 ns|     2.70 ns|
    +--------+----------+----------+------------+

+ Latency: 
    * Summary: 
    +---------+---------+----------+----------+-------+-------+------------------------------------------------+
    |  Latency (cycles) |  Latency (absolute) |    Interval   |                    Pipeline                    |
    |   min   |   max   |    min   |    max   |  min  |  max  |                      Type                      |
    +---------+---------+----------+----------+-------+-------+------------------------------------------------+
    |    16387|    16387|  0.164 ms|  0.164 ms|  16385|  16385|  loop auto-rewind stp (delay=0 clock cycles(s))|
    +---------+---------+----------+----------+-------+-------+------------------------------------------------+

    + Detail: 
        * Instance: 
        N/A

        * Loop: 
        +---------------------------------------+---------+---------+----------+-----------+-----------+-------+----------+
        |                                       |  Latency (cycles) | Iteration|  Initiation Interval  |  Trip |          |
        |               Loop Name               |   min   |   max   |  Latency |  achieved |   target  | Count | Pipelined|
        +---------------------------------------+---------+---------+----------+-----------+-----------+-------+----------+
        |- VITIS_LOOP_104_10_VITIS_LOOP_105_11  |    16385|    16385|         3|          1|          1|  16384|       yes|
        +---------------------------------------+---------+---------+----------+-----------+-----------+-------+----------+

============================================================
+ Verbose Summary: Synthesis Manager
============================================================
InlineROM: 1
ExposeGlobal: 0
============================================================
+ Verbose Summary: CDFG Model
============================================================
IsTopModel: 0
ResetActiveHigh: 1
IsCombinational: 0
IsDatapathOnly: 0
HasWiredReturn: 1
HasMFsm: 2
HasVarLatency: 1
IsPipeline: 0
IsRtlPipelined: 0
IsInstanceOverlapped: 0
IsDontTouch: 0
HasImplIP: 0
IsGatedGlobalClock: 0

+ Individual pipeline summary: 
  * Pipeline-0: initiation interval (II) = 1, depth = 3


============================================================
+ Verbose Summary: Schedule
============================================================
* Number of FSM states : 3
* Pipeline : 1
  Pipeline-0 : II = 1, D = 3, States = { 1 2 3 }
* Dataflow Pipeline: 0

* FSM state transitions: 
1 --> 2 
2 --> 3 
3 --> 

* FSM state operations: 

State 1 <SV = 0> <Delay = 3.21>
ST_1 : Operation 6 [1/1] (0.00ns)   --->   "%j = alloca i32 1" [top.cpp:105]   --->   Operation 6 'alloca' 'j' <Predicate = true> <Delay = 0.00>
ST_1 : Operation 7 [1/1] (0.00ns)   --->   "%i = alloca i32 1" [top.cpp:104]   --->   Operation 7 'alloca' 'i' <Predicate = true> <Delay = 0.00>
ST_1 : Operation 8 [1/1] (0.00ns)   --->   "%indvar_flatten6 = alloca i32 1"   --->   Operation 8 'alloca' 'indvar_flatten6' <Predicate = true> <Delay = 0.00>
ST_1 : Operation 9 [1/1] (0.00ns)   --->   "%sext_ln104_read = read i62 @_ssdm_op_Read.ap_auto.i62, i62 %sext_ln104"   --->   Operation 9 'read' 'sext_ln104_read' <Predicate = true> <Delay = 0.00>
ST_1 : Operation 10 [1/1] (0.00ns)   --->   "%sext_ln104_cast = sext i62 %sext_ln104_read"   --->   Operation 10 'sext' 'sext_ln104_cast' <Predicate = true> <Delay = 0.00>
ST_1 : Operation 11 [1/1] (0.00ns)   --->   "%specmemcore_ln0 = specmemcore void @_ssdm_op_SpecMemCore, i24 %top_kernel_ap_fixed_64_ap_fixed_24_10_0_0_0_64_C_1, i64 666, i64 30, i64 18446744073709551615"   --->   Operation 11 'specmemcore' 'specmemcore_ln0' <Predicate = true> <Delay = 0.00>
ST_1 : Operation 12 [1/1] (0.00ns)   --->   "%specmemcore_ln0 = specmemcore void @_ssdm_op_SpecMemCore, i24 %top_kernel_ap_fixed_64_ap_fixed_24_10_0_0_0_64_C, i64 666, i64 30, i64 18446744073709551615"   --->   Operation 12 'specmemcore' 'specmemcore_ln0' <Predicate = true> <Delay = 0.00>
ST_1 : Operation 13 [1/1] (0.00ns)   --->   "%specinterface_ln0 = specinterface void @_ssdm_op_SpecInterface, i32 %C, void @empty_3, i32 0, i32 0, void @empty_11, i32 0, i32 0, void @empty_8, void @empty_9, void @empty_11, i32 16, i32 16, i32 16, i32 16, void @empty_11, void @empty_11, i32 4294967295, i32 0, i32 0"   --->   Operation 13 'specinterface' 'specinterface_ln0' <Predicate = true> <Delay = 0.00>
ST_1 : Operation 14 [1/1] (0.48ns)   --->   "%store_ln0 = store i15 0, i15 %indvar_flatten6"   --->   Operation 14 'store' 'store_ln0' <Predicate = true> <Delay = 0.48>
ST_1 : Operation 15 [1/1] (0.48ns)   --->   "%store_ln104 = store i9 0, i9 %i" [top.cpp:104]   --->   Operation 15 'store' 'store_ln104' <Predicate = true> <Delay = 0.48>
ST_1 : Operation 16 [1/1] (0.48ns)   --->   "%store_ln105 = store i7 0, i7 %j" [top.cpp:105]   --->   Operation 16 'store' 'store_ln105' <Predicate = true> <Delay = 0.48>
ST_1 : Operation 17 [1/1] (0.00ns)   --->   "%br_ln0 = br void %for.inc141"   --->   Operation 17 'br' 'br_ln0' <Predicate = true> <Delay = 0.00>
ST_1 : Operation 18 [1/1] (0.00ns)   --->   "%indvar_flatten6_load = load i15 %indvar_flatten6" [top.cpp:104]   --->   Operation 18 'load' 'indvar_flatten6_load' <Predicate = true> <Delay = 0.00>
ST_1 : Operation 19 [1/1] (0.00ns)   --->   "%specbitsmap_ln0 = specbitsmap void @_ssdm_op_SpecBitsMap, i32 %C"   --->   Operation 19 'specbitsmap' 'specbitsmap_ln0' <Predicate = true> <Delay = 0.00>
ST_1 : Operation 20 [1/1] (1.00ns)   --->   "%icmp_ln104 = icmp_eq  i15 %indvar_flatten6_load, i15 16384" [top.cpp:104]   --->   Operation 20 'icmp' 'icmp_ln104' <Predicate = true> <Delay = 1.00> <CoreInst = "Cmp">   --->   Core 9 'Cmp' <Latency = 0> <II = 1> <Delay = 1.00> <FuncUnit> <Opcode : 'seteq' 'setne' 'setle' 'setge' 'setlt' 'setgt'> <InPorts = 2> <OutPorts = 1>
ST_1 : Operation 21 [1/1] (1.00ns)   --->   "%add_ln104_1 = add i15 %indvar_flatten6_load, i15 1" [top.cpp:104]   --->   Operation 21 'add' 'add_ln104_1' <Predicate = true> <Delay = 1.00> <CoreInst = "Adder">   --->   Core 1 'Adder' <Latency = 0> <II = 1> <Delay = 1.00> <FuncUnit> <Opcode : 'add' 'sub'> <InPorts = 2> <OutPorts = 1>
ST_1 : Operation 22 [1/1] (0.00ns)   --->   "%br_ln104 = br i1 %icmp_ln104, void %for.inc144, void %for.end146.exitStub" [top.cpp:104]   --->   Operation 22 'br' 'br_ln104' <Predicate = true> <Delay = 0.00>
ST_1 : Operation 23 [1/1] (0.00ns)   --->   "%j_load = load i7 %j" [top.cpp:105]   --->   Operation 23 'load' 'j_load' <Predicate = (!icmp_ln104)> <Delay = 0.00>
ST_1 : Operation 24 [1/1] (0.00ns)   --->   "%i_load = load i9 %i" [top.cpp:104]   --->   Operation 24 'load' 'i_load' <Predicate = (!icmp_ln104)> <Delay = 0.00>
ST_1 : Operation 25 [1/1] (0.92ns)   --->   "%add_ln104 = add i9 %i_load, i9 1" [top.cpp:104]   --->   Operation 25 'add' 'add_ln104' <Predicate = (!icmp_ln104)> <Delay = 0.92> <CoreInst = "Adder">   --->   Core 1 'Adder' <Latency = 0> <II = 1> <Delay = 0.92> <FuncUnit> <Opcode : 'add' 'sub'> <InPorts = 2> <OutPorts = 1>
ST_1 : Operation 26 [1/1] (0.89ns)   --->   "%icmp_ln105 = icmp_eq  i7 %j_load, i7 64" [top.cpp:105]   --->   Operation 26 'icmp' 'icmp_ln105' <Predicate = (!icmp_ln104)> <Delay = 0.89> <CoreInst = "Cmp">   --->   Core 9 'Cmp' <Latency = 0> <II = 1> <Delay = 0.89> <FuncUnit> <Opcode : 'seteq' 'setne' 'setle' 'setge' 'setlt' 'setgt'> <InPorts = 2> <OutPorts = 1>
ST_1 : Operation 27 [1/1] (0.42ns)   --->   "%select_ln104 = select i1 %icmp_ln105, i7 0, i7 %j_load" [top.cpp:104]   --->   Operation 27 'select' 'select_ln104' <Predicate = (!icmp_ln104)> <Delay = 0.42> <CoreInst = "Sel">   --->   Core 73 'Sel' <Latency = 0> <II = 1> <Delay = 0.42> <FuncUnit> <Opcode : 'select'> <InPorts = 3> <OutPorts = 1>
ST_1 : Operation 28 [1/1] (0.45ns)   --->   "%select_ln104_1 = select i1 %icmp_ln105, i9 %add_ln104, i9 %i_load" [top.cpp:104]   --->   Operation 28 'select' 'select_ln104_1' <Predicate = (!icmp_ln104)> <Delay = 0.45> <CoreInst = "Sel">   --->   Core 73 'Sel' <Latency = 0> <II = 1> <Delay = 0.45> <FuncUnit> <Opcode : 'select'> <InPorts = 3> <OutPorts = 1>
ST_1 : Operation 29 [1/1] (0.00ns)   --->   "%trunc_ln105 = trunc i9 %select_ln104_1" [top.cpp:105]   --->   Operation 29 'trunc' 'trunc_ln105' <Predicate = (!icmp_ln104)> <Delay = 0.00>
ST_1 : Operation 30 [1/1] (0.00ns)   --->   "%trunc_ln105_1 = trunc i7 %select_ln104" [top.cpp:105]   --->   Operation 30 'trunc' 'trunc_ln105_1' <Predicate = (!icmp_ln104)> <Delay = 0.00>
ST_1 : Operation 31 [1/1] (0.00ns)   --->   "%lshr_ln1 = partselect i5 @_ssdm_op_PartSelect.i5.i7.i32.i32, i7 %select_ln104, i32 1, i32 5" [top.cpp:105]   --->   Operation 31 'partselect' 'lshr_ln1' <Predicate = (!icmp_ln104)> <Delay = 0.00>
ST_1 : Operation 32 [1/1] (0.00ns)   --->   "%tmp_54 = bitconcatenate i13 @_ssdm_op_BitConcatenate.i13.i8.i5, i8 %trunc_ln105, i5 %lshr_ln1" [top.cpp:107]   --->   Operation 32 'bitconcatenate' 'tmp_54' <Predicate = (!icmp_ln104)> <Delay = 0.00>
ST_1 : Operation 33 [1/1] (0.00ns)   --->   "%zext_ln107_1 = zext i13 %tmp_54" [top.cpp:107]   --->   Operation 33 'zext' 'zext_ln107_1' <Predicate = (!icmp_ln104)> <Delay = 0.00>
ST_1 : Operation 34 [1/1] (0.00ns)   --->   "%top_kernel_ap_fixed_64_ap_fixed_24_10_0_0_0_64_C_1_addr = getelementptr i24 %top_kernel_ap_fixed_64_ap_fixed_24_10_0_0_0_64_C_1, i64 0, i64 %zext_ln107_1" [top.cpp:107]   --->   Operation 34 'getelementptr' 'top_kernel_ap_fixed_64_ap_fixed_24_10_0_0_0_64_C_1_addr' <Predicate = (!icmp_ln104)> <Delay = 0.00>
ST_1 : Operation 35 [1/1] (0.00ns)   --->   "%top_kernel_ap_fixed_64_ap_fixed_24_10_0_0_0_64_C_addr = getelementptr i24 %top_kernel_ap_fixed_64_ap_fixed_24_10_0_0_0_64_C, i64 0, i64 %zext_ln107_1" [top.cpp:107]   --->   Operation 35 'getelementptr' 'top_kernel_ap_fixed_64_ap_fixed_24_10_0_0_0_64_C_addr' <Predicate = (!icmp_ln104)> <Delay = 0.00>
ST_1 : Operation 36 [2/2] (1.35ns)   --->   "%top_kernel_ap_fixed_64_ap_fixed_24_10_0_0_0_64_C_1_load = load i13 %top_kernel_ap_fixed_64_ap_fixed_24_10_0_0_0_64_C_1_addr" [top.cpp:107]   --->   Operation 36 'load' 'top_kernel_ap_fixed_64_ap_fixed_24_10_0_0_0_64_C_1_load' <Predicate = (!icmp_ln104)> <Delay = 1.35> <CoreInst = "RAM_T2P_BRAM">   --->   Core 98 'RAM_T2P_BRAM' <Latency = 1> <II = 1> <Delay = 1.35> <Storage> <Opcode : 'load' 'store'> <Ports = 2> <Width = 24> <Depth = 8192> <RAM>
ST_1 : Operation 37 [2/2] (1.35ns)   --->   "%top_kernel_ap_fixed_64_ap_fixed_24_10_0_0_0_64_C_load = load i13 %top_kernel_ap_fixed_64_ap_fixed_24_10_0_0_0_64_C_addr" [top.cpp:107]   --->   Operation 37 'load' 'top_kernel_ap_fixed_64_ap_fixed_24_10_0_0_0_64_C_load' <Predicate = (!icmp_ln104)> <Delay = 1.35> <CoreInst = "RAM_T2P_BRAM">   --->   Core 98 'RAM_T2P_BRAM' <Latency = 1> <II = 1> <Delay = 1.35> <Storage> <Opcode : 'load' 'store'> <Ports = 2> <Width = 24> <Depth = 8192> <RAM>
ST_1 : Operation 38 [1/1] (0.89ns)   --->   "%add_ln105 = add i7 %select_ln104, i7 1" [top.cpp:105]   --->   Operation 38 'add' 'add_ln105' <Predicate = (!icmp_ln104)> <Delay = 0.89> <CoreInst = "Adder">   --->   Core 1 'Adder' <Latency = 0> <II = 1> <Delay = 0.89> <FuncUnit> <Opcode : 'add' 'sub'> <InPorts = 2> <OutPorts = 1>
ST_1 : Operation 39 [1/1] (0.48ns)   --->   "%store_ln104 = store i15 %add_ln104_1, i15 %indvar_flatten6" [top.cpp:104]   --->   Operation 39 'store' 'store_ln104' <Predicate = (!icmp_ln104)> <Delay = 0.48>
ST_1 : Operation 40 [1/1] (0.48ns)   --->   "%store_ln104 = store i9 %select_ln104_1, i9 %i" [top.cpp:104]   --->   Operation 40 'store' 'store_ln104' <Predicate = (!icmp_ln104)> <Delay = 0.48>
ST_1 : Operation 41 [1/1] (0.48ns)   --->   "%store_ln105 = store i7 %add_ln105, i7 %j" [top.cpp:105]   --->   Operation 41 'store' 'store_ln105' <Predicate = (!icmp_ln104)> <Delay = 0.48>

State 2 <SV = 1> <Delay = 1.78>
ST_2 : Operation 42 [1/2] ( I:1.35ns O:1.35ns )   --->   "%top_kernel_ap_fixed_64_ap_fixed_24_10_0_0_0_64_C_1_load = load i13 %top_kernel_ap_fixed_64_ap_fixed_24_10_0_0_0_64_C_1_addr" [top.cpp:107]   --->   Operation 42 'load' 'top_kernel_ap_fixed_64_ap_fixed_24_10_0_0_0_64_C_1_load' <Predicate = true> <Delay = 1.35> <CoreInst = "RAM_T2P_BRAM">   --->   Core 98 'RAM_T2P_BRAM' <Latency = 1> <II = 1> <Delay = 1.35> <Storage> <Opcode : 'load' 'store'> <Ports = 2> <Width = 24> <Depth = 8192> <RAM>
ST_2 : Operation 43 [1/2] ( I:1.35ns O:1.35ns )   --->   "%top_kernel_ap_fixed_64_ap_fixed_24_10_0_0_0_64_C_load = load i13 %top_kernel_ap_fixed_64_ap_fixed_24_10_0_0_0_64_C_addr" [top.cpp:107]   --->   Operation 43 'load' 'top_kernel_ap_fixed_64_ap_fixed_24_10_0_0_0_64_C_load' <Predicate = true> <Delay = 1.35> <CoreInst = "RAM_T2P_BRAM">   --->   Core 98 'RAM_T2P_BRAM' <Latency = 1> <II = 1> <Delay = 1.35> <Storage> <Opcode : 'load' 'store'> <Ports = 2> <Width = 24> <Depth = 8192> <RAM>
ST_2 : Operation 44 [1/1] (0.43ns)   --->   "%select_ln107 = select i1 %trunc_ln105_1, i24 %top_kernel_ap_fixed_64_ap_fixed_24_10_0_0_0_64_C_load, i24 %top_kernel_ap_fixed_64_ap_fixed_24_10_0_0_0_64_C_1_load" [top.cpp:107]   --->   Operation 44 'select' 'select_ln107' <Predicate = true> <Delay = 0.43> <CoreInst = "Sel">   --->   Core 73 'Sel' <Latency = 0> <II = 1> <Delay = 0.43> <FuncUnit> <Opcode : 'select'> <InPorts = 3> <OutPorts = 1>
ST_2 : Operation 52 [1/1] (0.48ns)   --->   "%ret_ln0 = ret"   --->   Operation 52 'ret' 'ret_ln0' <Predicate = (icmp_ln104)> <Delay = 0.48>

State 3 <SV = 2> <Delay = 7.30>
ST_3 : Operation 45 [1/1] (0.00ns)   --->   "%C_addr = getelementptr i32 %C, i64 %sext_ln104_cast" [top.cpp:104]   --->   Operation 45 'getelementptr' 'C_addr' <Predicate = true> <Delay = 0.00>
ST_3 : Operation 46 [1/1] (0.00ns)   --->   "%specloopname_ln0 = specloopname void @_ssdm_op_SpecLoopName, void @VITIS_LOOP_104_10_VITIS_LOOP_105_11_str"   --->   Operation 46 'specloopname' 'specloopname_ln0' <Predicate = true> <Delay = 0.00>
ST_3 : Operation 47 [1/1] (0.00ns)   --->   "%speclooptripcount_ln0 = speclooptripcount void @_ssdm_op_SpecLoopTripCount, i64 16384, i64 16384, i64 16384"   --->   Operation 47 'speclooptripcount' 'speclooptripcount_ln0' <Predicate = true> <Delay = 0.00>
ST_3 : Operation 48 [1/1] (0.00ns)   --->   "%specpipeline_ln106 = specpipeline void @_ssdm_op_SpecPipeline, i32 1, i32 0, i32 0, i32 0, void @empty_11" [top.cpp:106]   --->   Operation 48 'specpipeline' 'specpipeline_ln106' <Predicate = true> <Delay = 0.00>
ST_3 : Operation 49 [1/1] (0.00ns)   --->   "%zext_ln107 = zext i24 %select_ln107" [top.cpp:107]   --->   Operation 49 'zext' 'zext_ln107' <Predicate = true> <Delay = 0.00>
ST_3 : Operation 50 [1/1] (7.30ns)   --->   "%write_ln107 = write void @_ssdm_op_Write.m_axi.p1i32, i32 %C_addr, i32 %zext_ln107, i4 15" [top.cpp:107]   --->   Operation 50 'write' 'write_ln107' <Predicate = true> <Delay = 7.30> <CoreInst = "m_axi">   --->   Core 119 'm_axi' <Latency = 5> <II = 1> <Delay = 1.00> <Adapter> <Opcode : 'read' 'write' 'readreq' 'writereq' 'writeresp'>
ST_3 : Operation 51 [1/1] (0.00ns)   --->   "%br_ln105 = br void %for.inc141" [top.cpp:105]   --->   Operation 51 'br' 'br_ln105' <Predicate = true> <Delay = 0.00>


============================================================
+ Verbose Summary: Timing violations
============================================================
Target clock period: 10.000ns, clock uncertainty: 2.700ns.

 <State 1>: 3.219ns
The critical path consists of the following:
	'store' operation 0 bit ('store_ln104', top.cpp:104) of constant 0 on local variable 'i', top.cpp:104 [14]  (0.489 ns)
	'load' operation 9 bit ('i_load', top.cpp:104) on local variable 'i', top.cpp:104 [25]  (0.000 ns)
	'add' operation 9 bit ('add_ln104', top.cpp:104) [27]  (0.921 ns)
	'select' operation 9 bit ('select_ln104_1', top.cpp:104) [32]  (0.458 ns)
	'getelementptr' operation 13 bit ('top_kernel_ap_fixed_64_ap_fixed_24_10_0_0_0_64_C_1_addr', top.cpp:107) [39]  (0.000 ns)
	'load' operation 24 bit ('top_kernel_ap_fixed_64_ap_fixed_24_10_0_0_0_64_C_1_load', top.cpp:107) on array 'top_kernel_ap_fixed_64_ap_fixed_24_10_0_0_0_64_C_1' [41]  (1.352 ns)

 <State 2>: 1.787ns
The critical path consists of the following:
	'load' operation 24 bit ('top_kernel_ap_fixed_64_ap_fixed_24_10_0_0_0_64_C_1_load', top.cpp:107) on array 'top_kernel_ap_fixed_64_ap_fixed_24_10_0_0_0_64_C_1' [41]  (1.352 ns)
	'select' operation 24 bit ('select_ln107', top.cpp:107) [43]  (0.435 ns)

 <State 3>: 7.300ns
The critical path consists of the following:
	'getelementptr' operation 32 bit ('C_addr', top.cpp:104) [26]  (0.000 ns)
	bus write operation ('write_ln107', top.cpp:107) on port 'C' (top.cpp:107) [45]  (7.300 ns)


============================================================
+ Verbose Summary: Binding
============================================================
N/A
* FSMD analyzer results:
  - Output states:
 - Input state : 
  - Chain level:
	State 1
	State 2
	State 3


============================================================
+ Verbose Summary: Datapath Resource usage 
============================================================
N/A
