

================================================================
== Vitis HLS Report for 'top_kernel'
================================================================
* Date:           Thu Jan 29 16:02:55 2026

* Version:        2025.1.1 (Build 6214317 on Sep 11 2025)
* Project:        project_1
* Solution:       hls (Vivado IP Flow Target)
* Product family: zynquplus
* Target device:  xczu3eg-sbva484-1-e


================================================================
== Performance Estimates
================================================================
+ Timing: 
    * Summary: 
    +--------+----------+----------+------------+
    |  Clock |  Target  | Estimated| Uncertainty|
    +--------+----------+----------+------------+
    |ap_clk  |  10.00 ns|  7.116 ns|     2.70 ns|
    +--------+----------+----------+------------+

+ Latency: 
    * Summary: 
    +---------+---------+----------+----------+-------+-------+---------+
    |  Latency (cycles) |  Latency (absolute) |    Interval   | Pipeline|
    |   min   |   max   |    min   |    max   |  min  |  max  |   Type  |
    +---------+---------+----------+----------+-------+-------+---------+
    |    26691|    26691|  0.267 ms|  0.267 ms|  26692|  26692|       no|
    +---------+---------+----------+----------+-------+-------+---------+

    + Detail: 
        * Instance: 
        N/A

        * Loop: 
        N/A

============================================================
+ Verbose Summary: Synthesis Manager
============================================================
InlineROM: 1
ExposeGlobal: 0
============================================================
+ Verbose Summary: CDFG Model
============================================================
IsTopModel: 1
ResetActiveHigh: 1
IsCombinational: 0
IsDatapathOnly: 0
HasWiredReturn: 1
HasMFsm: 0
HasVarLatency: 1
IsPipeline: 0
IsRtlPipelined: 0
IsInstanceOverlapped: 0
IsDontTouch: 0
HasImplIP: 0
IsGatedGlobalClock: 0


============================================================
+ Verbose Summary: Schedule
============================================================
* Number of FSM states : 8
* Pipeline : 0
* Dataflow Pipeline: 0

* FSM state transitions: 
1 --> 2 
2 --> 3 
3 --> 4 
4 --> 5 
5 --> 6 
6 --> 7 
7 --> 8 
8 --> 

* FSM state operations: 

State 1 <SV = 0> <Delay = 0.00>
ST_1 : Operation 9 [1/1] (0.00ns)   --->   "%scale_loc = alloca i64 1"   --->   Operation 9 'alloca' 'scale_loc' <Predicate = true> <Delay = 0.00>
ST_1 : Operation 10 [1/1] (0.00ns)   --->   "%scale_1_loc = alloca i64 1"   --->   Operation 10 'alloca' 'scale_1_loc' <Predicate = true> <Delay = 0.00>
ST_1 : Operation 11 [1/1] (0.00ns)   --->   "%scale_2_loc = alloca i64 1"   --->   Operation 11 'alloca' 'scale_2_loc' <Predicate = true> <Delay = 0.00>
ST_1 : Operation 12 [1/1] (0.00ns)   --->   "%scale_3_loc = alloca i64 1"   --->   Operation 12 'alloca' 'scale_3_loc' <Predicate = true> <Delay = 0.00>
ST_1 : Operation 13 [1/1] (0.00ns)   --->   "%scale_4_loc = alloca i64 1"   --->   Operation 13 'alloca' 'scale_4_loc' <Predicate = true> <Delay = 0.00>
ST_1 : Operation 14 [1/1] (0.00ns)   --->   "%scale_5_loc = alloca i64 1"   --->   Operation 14 'alloca' 'scale_5_loc' <Predicate = true> <Delay = 0.00>
ST_1 : Operation 15 [1/1] (0.00ns)   --->   "%scale_6_loc = alloca i64 1"   --->   Operation 15 'alloca' 'scale_6_loc' <Predicate = true> <Delay = 0.00>
ST_1 : Operation 16 [1/1] (0.00ns)   --->   "%scale_7_loc = alloca i64 1"   --->   Operation 16 'alloca' 'scale_7_loc' <Predicate = true> <Delay = 0.00>
ST_1 : Operation 17 [1/1] (0.00ns)   --->   "%scale_8_loc = alloca i64 1"   --->   Operation 17 'alloca' 'scale_8_loc' <Predicate = true> <Delay = 0.00>
ST_1 : Operation 18 [1/1] (0.00ns)   --->   "%scale_9_loc = alloca i64 1"   --->   Operation 18 'alloca' 'scale_9_loc' <Predicate = true> <Delay = 0.00>
ST_1 : Operation 19 [1/1] (0.00ns)   --->   "%scale_10_loc = alloca i64 1"   --->   Operation 19 'alloca' 'scale_10_loc' <Predicate = true> <Delay = 0.00>
ST_1 : Operation 20 [1/1] (0.00ns)   --->   "%scale_11_loc = alloca i64 1"   --->   Operation 20 'alloca' 'scale_11_loc' <Predicate = true> <Delay = 0.00>
ST_1 : Operation 21 [1/1] (0.00ns)   --->   "%scale_12_loc = alloca i64 1"   --->   Operation 21 'alloca' 'scale_12_loc' <Predicate = true> <Delay = 0.00>
ST_1 : Operation 22 [1/1] (0.00ns)   --->   "%scale_13_loc = alloca i64 1"   --->   Operation 22 'alloca' 'scale_13_loc' <Predicate = true> <Delay = 0.00>
ST_1 : Operation 23 [1/1] (0.00ns)   --->   "%scale_14_loc = alloca i64 1"   --->   Operation 23 'alloca' 'scale_14_loc' <Predicate = true> <Delay = 0.00>
ST_1 : Operation 24 [1/1] (0.00ns)   --->   "%scale_15_loc = alloca i64 1"   --->   Operation 24 'alloca' 'scale_15_loc' <Predicate = true> <Delay = 0.00>
ST_1 : Operation 25 [1/1] (0.00ns)   --->   "%scale_16_loc = alloca i64 1"   --->   Operation 25 'alloca' 'scale_16_loc' <Predicate = true> <Delay = 0.00>
ST_1 : Operation 26 [1/1] (0.00ns)   --->   "%scale_17_loc = alloca i64 1"   --->   Operation 26 'alloca' 'scale_17_loc' <Predicate = true> <Delay = 0.00>
ST_1 : Operation 27 [1/1] (0.00ns)   --->   "%scale_18_loc = alloca i64 1"   --->   Operation 27 'alloca' 'scale_18_loc' <Predicate = true> <Delay = 0.00>
ST_1 : Operation 28 [1/1] (0.00ns)   --->   "%scale_19_loc = alloca i64 1"   --->   Operation 28 'alloca' 'scale_19_loc' <Predicate = true> <Delay = 0.00>
ST_1 : Operation 29 [1/1] (0.00ns)   --->   "%scale_20_loc = alloca i64 1"   --->   Operation 29 'alloca' 'scale_20_loc' <Predicate = true> <Delay = 0.00>
ST_1 : Operation 30 [1/1] (0.00ns)   --->   "%scale_21_loc = alloca i64 1"   --->   Operation 30 'alloca' 'scale_21_loc' <Predicate = true> <Delay = 0.00>
ST_1 : Operation 31 [1/1] (0.00ns)   --->   "%scale_22_loc = alloca i64 1"   --->   Operation 31 'alloca' 'scale_22_loc' <Predicate = true> <Delay = 0.00>
ST_1 : Operation 32 [1/1] (0.00ns)   --->   "%scale_23_loc = alloca i64 1"   --->   Operation 32 'alloca' 'scale_23_loc' <Predicate = true> <Delay = 0.00>
ST_1 : Operation 33 [1/1] (0.00ns)   --->   "%scale_24_loc = alloca i64 1"   --->   Operation 33 'alloca' 'scale_24_loc' <Predicate = true> <Delay = 0.00>
ST_1 : Operation 34 [1/1] (0.00ns)   --->   "%scale_25_loc = alloca i64 1"   --->   Operation 34 'alloca' 'scale_25_loc' <Predicate = true> <Delay = 0.00>
ST_1 : Operation 35 [1/1] (0.00ns)   --->   "%scale_26_loc = alloca i64 1"   --->   Operation 35 'alloca' 'scale_26_loc' <Predicate = true> <Delay = 0.00>
ST_1 : Operation 36 [1/1] (0.00ns)   --->   "%scale_27_loc = alloca i64 1"   --->   Operation 36 'alloca' 'scale_27_loc' <Predicate = true> <Delay = 0.00>
ST_1 : Operation 37 [1/1] (0.00ns)   --->   "%scale_28_loc = alloca i64 1"   --->   Operation 37 'alloca' 'scale_28_loc' <Predicate = true> <Delay = 0.00>
ST_1 : Operation 38 [1/1] (0.00ns)   --->   "%scale_29_loc = alloca i64 1"   --->   Operation 38 'alloca' 'scale_29_loc' <Predicate = true> <Delay = 0.00>
ST_1 : Operation 39 [1/1] (0.00ns)   --->   "%scale_30_loc = alloca i64 1"   --->   Operation 39 'alloca' 'scale_30_loc' <Predicate = true> <Delay = 0.00>
ST_1 : Operation 40 [1/1] (0.00ns)   --->   "%scale_31_loc = alloca i64 1"   --->   Operation 40 'alloca' 'scale_31_loc' <Predicate = true> <Delay = 0.00>
ST_1 : Operation 41 [1/1] (0.00ns)   --->   "%scale_32_loc = alloca i64 1"   --->   Operation 41 'alloca' 'scale_32_loc' <Predicate = true> <Delay = 0.00>
ST_1 : Operation 42 [1/1] (0.00ns)   --->   "%scale_33_loc = alloca i64 1"   --->   Operation 42 'alloca' 'scale_33_loc' <Predicate = true> <Delay = 0.00>
ST_1 : Operation 43 [1/1] (0.00ns)   --->   "%scale_34_loc = alloca i64 1"   --->   Operation 43 'alloca' 'scale_34_loc' <Predicate = true> <Delay = 0.00>
ST_1 : Operation 44 [1/1] (0.00ns)   --->   "%scale_35_loc = alloca i64 1"   --->   Operation 44 'alloca' 'scale_35_loc' <Predicate = true> <Delay = 0.00>
ST_1 : Operation 45 [1/1] (0.00ns)   --->   "%scale_36_loc = alloca i64 1"   --->   Operation 45 'alloca' 'scale_36_loc' <Predicate = true> <Delay = 0.00>
ST_1 : Operation 46 [1/1] (0.00ns)   --->   "%scale_37_loc = alloca i64 1"   --->   Operation 46 'alloca' 'scale_37_loc' <Predicate = true> <Delay = 0.00>
ST_1 : Operation 47 [1/1] (0.00ns)   --->   "%scale_38_loc = alloca i64 1"   --->   Operation 47 'alloca' 'scale_38_loc' <Predicate = true> <Delay = 0.00>
ST_1 : Operation 48 [1/1] (0.00ns)   --->   "%scale_39_loc = alloca i64 1"   --->   Operation 48 'alloca' 'scale_39_loc' <Predicate = true> <Delay = 0.00>
ST_1 : Operation 49 [1/1] (0.00ns)   --->   "%scale_40_loc = alloca i64 1"   --->   Operation 49 'alloca' 'scale_40_loc' <Predicate = true> <Delay = 0.00>
ST_1 : Operation 50 [1/1] (0.00ns)   --->   "%scale_41_loc = alloca i64 1"   --->   Operation 50 'alloca' 'scale_41_loc' <Predicate = true> <Delay = 0.00>
ST_1 : Operation 51 [1/1] (0.00ns)   --->   "%scale_42_loc = alloca i64 1"   --->   Operation 51 'alloca' 'scale_42_loc' <Predicate = true> <Delay = 0.00>
ST_1 : Operation 52 [1/1] (0.00ns)   --->   "%scale_43_loc = alloca i64 1"   --->   Operation 52 'alloca' 'scale_43_loc' <Predicate = true> <Delay = 0.00>
ST_1 : Operation 53 [1/1] (0.00ns)   --->   "%scale_44_loc = alloca i64 1"   --->   Operation 53 'alloca' 'scale_44_loc' <Predicate = true> <Delay = 0.00>
ST_1 : Operation 54 [1/1] (0.00ns)   --->   "%scale_45_loc = alloca i64 1"   --->   Operation 54 'alloca' 'scale_45_loc' <Predicate = true> <Delay = 0.00>
ST_1 : Operation 55 [1/1] (0.00ns)   --->   "%scale_46_loc = alloca i64 1"   --->   Operation 55 'alloca' 'scale_46_loc' <Predicate = true> <Delay = 0.00>
ST_1 : Operation 56 [1/1] (0.00ns)   --->   "%scale_47_loc = alloca i64 1"   --->   Operation 56 'alloca' 'scale_47_loc' <Predicate = true> <Delay = 0.00>
ST_1 : Operation 57 [1/1] (0.00ns)   --->   "%scale_48_loc = alloca i64 1"   --->   Operation 57 'alloca' 'scale_48_loc' <Predicate = true> <Delay = 0.00>
ST_1 : Operation 58 [1/1] (0.00ns)   --->   "%scale_49_loc = alloca i64 1"   --->   Operation 58 'alloca' 'scale_49_loc' <Predicate = true> <Delay = 0.00>
ST_1 : Operation 59 [1/1] (0.00ns)   --->   "%scale_50_loc = alloca i64 1"   --->   Operation 59 'alloca' 'scale_50_loc' <Predicate = true> <Delay = 0.00>
ST_1 : Operation 60 [1/1] (0.00ns)   --->   "%scale_51_loc = alloca i64 1"   --->   Operation 60 'alloca' 'scale_51_loc' <Predicate = true> <Delay = 0.00>
ST_1 : Operation 61 [1/1] (0.00ns)   --->   "%scale_52_loc = alloca i64 1"   --->   Operation 61 'alloca' 'scale_52_loc' <Predicate = true> <Delay = 0.00>
ST_1 : Operation 62 [1/1] (0.00ns)   --->   "%scale_53_loc = alloca i64 1"   --->   Operation 62 'alloca' 'scale_53_loc' <Predicate = true> <Delay = 0.00>
ST_1 : Operation 63 [1/1] (0.00ns)   --->   "%scale_54_loc = alloca i64 1"   --->   Operation 63 'alloca' 'scale_54_loc' <Predicate = true> <Delay = 0.00>
ST_1 : Operation 64 [1/1] (0.00ns)   --->   "%scale_55_loc = alloca i64 1"   --->   Operation 64 'alloca' 'scale_55_loc' <Predicate = true> <Delay = 0.00>
ST_1 : Operation 65 [1/1] (0.00ns)   --->   "%scale_56_loc = alloca i64 1"   --->   Operation 65 'alloca' 'scale_56_loc' <Predicate = true> <Delay = 0.00>
ST_1 : Operation 66 [1/1] (0.00ns)   --->   "%scale_57_loc = alloca i64 1"   --->   Operation 66 'alloca' 'scale_57_loc' <Predicate = true> <Delay = 0.00>
ST_1 : Operation 67 [1/1] (0.00ns)   --->   "%scale_58_loc = alloca i64 1"   --->   Operation 67 'alloca' 'scale_58_loc' <Predicate = true> <Delay = 0.00>
ST_1 : Operation 68 [1/1] (0.00ns)   --->   "%scale_59_loc = alloca i64 1"   --->   Operation 68 'alloca' 'scale_59_loc' <Predicate = true> <Delay = 0.00>
ST_1 : Operation 69 [1/1] (0.00ns)   --->   "%scale_60_loc = alloca i64 1"   --->   Operation 69 'alloca' 'scale_60_loc' <Predicate = true> <Delay = 0.00>
ST_1 : Operation 70 [1/1] (0.00ns)   --->   "%scale_61_loc = alloca i64 1"   --->   Operation 70 'alloca' 'scale_61_loc' <Predicate = true> <Delay = 0.00>
ST_1 : Operation 71 [1/1] (0.00ns)   --->   "%scale_62_loc = alloca i64 1"   --->   Operation 71 'alloca' 'scale_62_loc' <Predicate = true> <Delay = 0.00>
ST_1 : Operation 72 [1/1] (0.00ns)   --->   "%scale_63_loc = alloca i64 1"   --->   Operation 72 'alloca' 'scale_63_loc' <Predicate = true> <Delay = 0.00>
ST_1 : Operation 73 [1/1] (0.00ns)   --->   "%col_sum_63_load_loc = alloca i64 1"   --->   Operation 73 'alloca' 'col_sum_63_load_loc' <Predicate = true> <Delay = 0.00>
ST_1 : Operation 74 [1/1] (0.00ns)   --->   "%col_sum_62_load_loc = alloca i64 1"   --->   Operation 74 'alloca' 'col_sum_62_load_loc' <Predicate = true> <Delay = 0.00>
ST_1 : Operation 75 [1/1] (0.00ns)   --->   "%col_sum_61_load_loc = alloca i64 1"   --->   Operation 75 'alloca' 'col_sum_61_load_loc' <Predicate = true> <Delay = 0.00>
ST_1 : Operation 76 [1/1] (0.00ns)   --->   "%col_sum_60_load_loc = alloca i64 1"   --->   Operation 76 'alloca' 'col_sum_60_load_loc' <Predicate = true> <Delay = 0.00>
ST_1 : Operation 77 [1/1] (0.00ns)   --->   "%col_sum_59_load_loc = alloca i64 1"   --->   Operation 77 'alloca' 'col_sum_59_load_loc' <Predicate = true> <Delay = 0.00>
ST_1 : Operation 78 [1/1] (0.00ns)   --->   "%col_sum_58_load_loc = alloca i64 1"   --->   Operation 78 'alloca' 'col_sum_58_load_loc' <Predicate = true> <Delay = 0.00>
ST_1 : Operation 79 [1/1] (0.00ns)   --->   "%col_sum_57_load_loc = alloca i64 1"   --->   Operation 79 'alloca' 'col_sum_57_load_loc' <Predicate = true> <Delay = 0.00>
ST_1 : Operation 80 [1/1] (0.00ns)   --->   "%col_sum_56_load_loc = alloca i64 1"   --->   Operation 80 'alloca' 'col_sum_56_load_loc' <Predicate = true> <Delay = 0.00>
ST_1 : Operation 81 [1/1] (0.00ns)   --->   "%col_sum_55_load_loc = alloca i64 1"   --->   Operation 81 'alloca' 'col_sum_55_load_loc' <Predicate = true> <Delay = 0.00>
ST_1 : Operation 82 [1/1] (0.00ns)   --->   "%col_sum_54_load_loc = alloca i64 1"   --->   Operation 82 'alloca' 'col_sum_54_load_loc' <Predicate = true> <Delay = 0.00>
ST_1 : Operation 83 [1/1] (0.00ns)   --->   "%col_sum_53_load_loc = alloca i64 1"   --->   Operation 83 'alloca' 'col_sum_53_load_loc' <Predicate = true> <Delay = 0.00>
ST_1 : Operation 84 [1/1] (0.00ns)   --->   "%col_sum_52_load_loc = alloca i64 1"   --->   Operation 84 'alloca' 'col_sum_52_load_loc' <Predicate = true> <Delay = 0.00>
ST_1 : Operation 85 [1/1] (0.00ns)   --->   "%col_sum_51_load_loc = alloca i64 1"   --->   Operation 85 'alloca' 'col_sum_51_load_loc' <Predicate = true> <Delay = 0.00>
ST_1 : Operation 86 [1/1] (0.00ns)   --->   "%col_sum_50_load_loc = alloca i64 1"   --->   Operation 86 'alloca' 'col_sum_50_load_loc' <Predicate = true> <Delay = 0.00>
ST_1 : Operation 87 [1/1] (0.00ns)   --->   "%col_sum_49_load_loc = alloca i64 1"   --->   Operation 87 'alloca' 'col_sum_49_load_loc' <Predicate = true> <Delay = 0.00>
ST_1 : Operation 88 [1/1] (0.00ns)   --->   "%col_sum_48_load_loc = alloca i64 1"   --->   Operation 88 'alloca' 'col_sum_48_load_loc' <Predicate = true> <Delay = 0.00>
ST_1 : Operation 89 [1/1] (0.00ns)   --->   "%col_sum_47_load_loc = alloca i64 1"   --->   Operation 89 'alloca' 'col_sum_47_load_loc' <Predicate = true> <Delay = 0.00>
ST_1 : Operation 90 [1/1] (0.00ns)   --->   "%col_sum_46_load_loc = alloca i64 1"   --->   Operation 90 'alloca' 'col_sum_46_load_loc' <Predicate = true> <Delay = 0.00>
ST_1 : Operation 91 [1/1] (0.00ns)   --->   "%col_sum_45_load_loc = alloca i64 1"   --->   Operation 91 'alloca' 'col_sum_45_load_loc' <Predicate = true> <Delay = 0.00>
ST_1 : Operation 92 [1/1] (0.00ns)   --->   "%col_sum_44_load_loc = alloca i64 1"   --->   Operation 92 'alloca' 'col_sum_44_load_loc' <Predicate = true> <Delay = 0.00>
ST_1 : Operation 93 [1/1] (0.00ns)   --->   "%col_sum_43_load_loc = alloca i64 1"   --->   Operation 93 'alloca' 'col_sum_43_load_loc' <Predicate = true> <Delay = 0.00>
ST_1 : Operation 94 [1/1] (0.00ns)   --->   "%col_sum_42_load_loc = alloca i64 1"   --->   Operation 94 'alloca' 'col_sum_42_load_loc' <Predicate = true> <Delay = 0.00>
ST_1 : Operation 95 [1/1] (0.00ns)   --->   "%col_sum_41_load_loc = alloca i64 1"   --->   Operation 95 'alloca' 'col_sum_41_load_loc' <Predicate = true> <Delay = 0.00>
ST_1 : Operation 96 [1/1] (0.00ns)   --->   "%col_sum_40_load_loc = alloca i64 1"   --->   Operation 96 'alloca' 'col_sum_40_load_loc' <Predicate = true> <Delay = 0.00>
ST_1 : Operation 97 [1/1] (0.00ns)   --->   "%col_sum_39_load_loc = alloca i64 1"   --->   Operation 97 'alloca' 'col_sum_39_load_loc' <Predicate = true> <Delay = 0.00>
ST_1 : Operation 98 [1/1] (0.00ns)   --->   "%col_sum_38_load_loc = alloca i64 1"   --->   Operation 98 'alloca' 'col_sum_38_load_loc' <Predicate = true> <Delay = 0.00>
ST_1 : Operation 99 [1/1] (0.00ns)   --->   "%col_sum_37_load_loc = alloca i64 1"   --->   Operation 99 'alloca' 'col_sum_37_load_loc' <Predicate = true> <Delay = 0.00>
ST_1 : Operation 100 [1/1] (0.00ns)   --->   "%col_sum_36_load_loc = alloca i64 1"   --->   Operation 100 'alloca' 'col_sum_36_load_loc' <Predicate = true> <Delay = 0.00>
ST_1 : Operation 101 [1/1] (0.00ns)   --->   "%col_sum_35_load_loc = alloca i64 1"   --->   Operation 101 'alloca' 'col_sum_35_load_loc' <Predicate = true> <Delay = 0.00>
ST_1 : Operation 102 [1/1] (0.00ns)   --->   "%col_sum_34_load_loc = alloca i64 1"   --->   Operation 102 'alloca' 'col_sum_34_load_loc' <Predicate = true> <Delay = 0.00>
ST_1 : Operation 103 [1/1] (0.00ns)   --->   "%col_sum_33_load_loc = alloca i64 1"   --->   Operation 103 'alloca' 'col_sum_33_load_loc' <Predicate = true> <Delay = 0.00>
ST_1 : Operation 104 [1/1] (0.00ns)   --->   "%col_sum_32_load_loc = alloca i64 1"   --->   Operation 104 'alloca' 'col_sum_32_load_loc' <Predicate = true> <Delay = 0.00>
ST_1 : Operation 105 [1/1] (0.00ns)   --->   "%col_sum_31_load_loc = alloca i64 1"   --->   Operation 105 'alloca' 'col_sum_31_load_loc' <Predicate = true> <Delay = 0.00>
ST_1 : Operation 106 [1/1] (0.00ns)   --->   "%col_sum_30_load_loc = alloca i64 1"   --->   Operation 106 'alloca' 'col_sum_30_load_loc' <Predicate = true> <Delay = 0.00>
ST_1 : Operation 107 [1/1] (0.00ns)   --->   "%col_sum_29_load_loc = alloca i64 1"   --->   Operation 107 'alloca' 'col_sum_29_load_loc' <Predicate = true> <Delay = 0.00>
ST_1 : Operation 108 [1/1] (0.00ns)   --->   "%col_sum_28_load_loc = alloca i64 1"   --->   Operation 108 'alloca' 'col_sum_28_load_loc' <Predicate = true> <Delay = 0.00>
ST_1 : Operation 109 [1/1] (0.00ns)   --->   "%col_sum_27_load_loc = alloca i64 1"   --->   Operation 109 'alloca' 'col_sum_27_load_loc' <Predicate = true> <Delay = 0.00>
ST_1 : Operation 110 [1/1] (0.00ns)   --->   "%col_sum_26_load_loc = alloca i64 1"   --->   Operation 110 'alloca' 'col_sum_26_load_loc' <Predicate = true> <Delay = 0.00>
ST_1 : Operation 111 [1/1] (0.00ns)   --->   "%col_sum_25_load_loc = alloca i64 1"   --->   Operation 111 'alloca' 'col_sum_25_load_loc' <Predicate = true> <Delay = 0.00>
ST_1 : Operation 112 [1/1] (0.00ns)   --->   "%col_sum_24_load_loc = alloca i64 1"   --->   Operation 112 'alloca' 'col_sum_24_load_loc' <Predicate = true> <Delay = 0.00>
ST_1 : Operation 113 [1/1] (0.00ns)   --->   "%col_sum_23_load_loc = alloca i64 1"   --->   Operation 113 'alloca' 'col_sum_23_load_loc' <Predicate = true> <Delay = 0.00>
ST_1 : Operation 114 [1/1] (0.00ns)   --->   "%col_sum_22_load_loc = alloca i64 1"   --->   Operation 114 'alloca' 'col_sum_22_load_loc' <Predicate = true> <Delay = 0.00>
ST_1 : Operation 115 [1/1] (0.00ns)   --->   "%col_sum_21_load_loc = alloca i64 1"   --->   Operation 115 'alloca' 'col_sum_21_load_loc' <Predicate = true> <Delay = 0.00>
ST_1 : Operation 116 [1/1] (0.00ns)   --->   "%col_sum_20_load_loc = alloca i64 1"   --->   Operation 116 'alloca' 'col_sum_20_load_loc' <Predicate = true> <Delay = 0.00>
ST_1 : Operation 117 [1/1] (0.00ns)   --->   "%col_sum_19_load_loc = alloca i64 1"   --->   Operation 117 'alloca' 'col_sum_19_load_loc' <Predicate = true> <Delay = 0.00>
ST_1 : Operation 118 [1/1] (0.00ns)   --->   "%col_sum_18_load_loc = alloca i64 1"   --->   Operation 118 'alloca' 'col_sum_18_load_loc' <Predicate = true> <Delay = 0.00>
ST_1 : Operation 119 [1/1] (0.00ns)   --->   "%col_sum_17_load_loc = alloca i64 1"   --->   Operation 119 'alloca' 'col_sum_17_load_loc' <Predicate = true> <Delay = 0.00>
ST_1 : Operation 120 [1/1] (0.00ns)   --->   "%col_sum_16_load_loc = alloca i64 1"   --->   Operation 120 'alloca' 'col_sum_16_load_loc' <Predicate = true> <Delay = 0.00>
ST_1 : Operation 121 [1/1] (0.00ns)   --->   "%col_sum_15_load_loc = alloca i64 1"   --->   Operation 121 'alloca' 'col_sum_15_load_loc' <Predicate = true> <Delay = 0.00>
ST_1 : Operation 122 [1/1] (0.00ns)   --->   "%col_sum_14_load_loc = alloca i64 1"   --->   Operation 122 'alloca' 'col_sum_14_load_loc' <Predicate = true> <Delay = 0.00>
ST_1 : Operation 123 [1/1] (0.00ns)   --->   "%col_sum_13_load_loc = alloca i64 1"   --->   Operation 123 'alloca' 'col_sum_13_load_loc' <Predicate = true> <Delay = 0.00>
ST_1 : Operation 124 [1/1] (0.00ns)   --->   "%col_sum_12_load_loc = alloca i64 1"   --->   Operation 124 'alloca' 'col_sum_12_load_loc' <Predicate = true> <Delay = 0.00>
ST_1 : Operation 125 [1/1] (0.00ns)   --->   "%col_sum_11_load_loc = alloca i64 1"   --->   Operation 125 'alloca' 'col_sum_11_load_loc' <Predicate = true> <Delay = 0.00>
ST_1 : Operation 126 [1/1] (0.00ns)   --->   "%col_sum_10_load_loc = alloca i64 1"   --->   Operation 126 'alloca' 'col_sum_10_load_loc' <Predicate = true> <Delay = 0.00>
ST_1 : Operation 127 [1/1] (0.00ns)   --->   "%col_sum_9_load_loc = alloca i64 1"   --->   Operation 127 'alloca' 'col_sum_9_load_loc' <Predicate = true> <Delay = 0.00>
ST_1 : Operation 128 [1/1] (0.00ns)   --->   "%col_sum_8_load_loc = alloca i64 1"   --->   Operation 128 'alloca' 'col_sum_8_load_loc' <Predicate = true> <Delay = 0.00>
ST_1 : Operation 129 [1/1] (0.00ns)   --->   "%col_sum_7_load_loc = alloca i64 1"   --->   Operation 129 'alloca' 'col_sum_7_load_loc' <Predicate = true> <Delay = 0.00>
ST_1 : Operation 130 [1/1] (0.00ns)   --->   "%col_sum_6_load_loc = alloca i64 1"   --->   Operation 130 'alloca' 'col_sum_6_load_loc' <Predicate = true> <Delay = 0.00>
ST_1 : Operation 131 [1/1] (0.00ns)   --->   "%col_sum_5_load_loc = alloca i64 1"   --->   Operation 131 'alloca' 'col_sum_5_load_loc' <Predicate = true> <Delay = 0.00>
ST_1 : Operation 132 [1/1] (0.00ns)   --->   "%col_sum_4_load_loc = alloca i64 1"   --->   Operation 132 'alloca' 'col_sum_4_load_loc' <Predicate = true> <Delay = 0.00>
ST_1 : Operation 133 [1/1] (0.00ns)   --->   "%col_sum_3_load_loc = alloca i64 1"   --->   Operation 133 'alloca' 'col_sum_3_load_loc' <Predicate = true> <Delay = 0.00>
ST_1 : Operation 134 [1/1] (0.00ns)   --->   "%col_sum_2_load_loc = alloca i64 1"   --->   Operation 134 'alloca' 'col_sum_2_load_loc' <Predicate = true> <Delay = 0.00>
ST_1 : Operation 135 [1/1] (0.00ns)   --->   "%col_sum_1_load_loc = alloca i64 1"   --->   Operation 135 'alloca' 'col_sum_1_load_loc' <Predicate = true> <Delay = 0.00>
ST_1 : Operation 136 [1/1] (0.00ns)   --->   "%col_sum_load_loc = alloca i64 1"   --->   Operation 136 'alloca' 'col_sum_load_loc' <Predicate = true> <Delay = 0.00>
ST_1 : Operation 137 [2/2] (0.00ns)   --->   "%call_ln0 = call void @top_kernel_Pipeline_VITIS_LOOP_43_2_VITIS_LOOP_45_3, i24 %A, i24 %top_kernel_ap_fixed_64_ap_fixed_24_8_0_0_0_64_A_loc_7, i24 %top_kernel_ap_fixed_64_ap_fixed_24_8_0_0_0_64_A_loc_6, i24 %top_kernel_ap_fixed_64_ap_fixed_24_8_0_0_0_64_A_loc_5, i24 %top_kernel_ap_fixed_64_ap_fixed_24_8_0_0_0_64_A_loc_4, i24 %top_kernel_ap_fixed_64_ap_fixed_24_8_0_0_0_64_A_loc_3, i24 %top_kernel_ap_fixed_64_ap_fixed_24_8_0_0_0_64_A_loc_2, i24 %top_kernel_ap_fixed_64_ap_fixed_24_8_0_0_0_64_A_loc_1, i24 %top_kernel_ap_fixed_64_ap_fixed_24_8_0_0_0_64_A_loc, i24 %denom_row"   --->   Operation 137 'call' 'call_ln0' <Predicate = true> <Delay = 0.00> <CoreType = "Generic">   --->   Generic Core

State 2 <SV = 1> <Delay = 1.98>
ST_2 : Operation 138 [1/2] (1.98ns)   --->   "%call_ln0 = call void @top_kernel_Pipeline_VITIS_LOOP_43_2_VITIS_LOOP_45_3, i24 %A, i24 %top_kernel_ap_fixed_64_ap_fixed_24_8_0_0_0_64_A_loc_7, i24 %top_kernel_ap_fixed_64_ap_fixed_24_8_0_0_0_64_A_loc_6, i24 %top_kernel_ap_fixed_64_ap_fixed_24_8_0_0_0_64_A_loc_5, i24 %top_kernel_ap_fixed_64_ap_fixed_24_8_0_0_0_64_A_loc_4, i24 %top_kernel_ap_fixed_64_ap_fixed_24_8_0_0_0_64_A_loc_3, i24 %top_kernel_ap_fixed_64_ap_fixed_24_8_0_0_0_64_A_loc_2, i24 %top_kernel_ap_fixed_64_ap_fixed_24_8_0_0_0_64_A_loc_1, i24 %top_kernel_ap_fixed_64_ap_fixed_24_8_0_0_0_64_A_loc, i24 %denom_row"   --->   Operation 138 'call' 'call_ln0' <Predicate = true> <Delay = 1.98> <CoreType = "Generic">   --->   Generic Core

State 3 <SV = 2> <Delay = 0.00>
ST_3 : Operation 139 [2/2] (0.00ns)   --->   "%call_ln0 = call void @top_kernel_Pipeline_VITIS_LOOP_59_4, i24 %col_sum_load_loc, i24 %col_sum_1_load_loc, i24 %col_sum_2_load_loc, i24 %col_sum_3_load_loc, i24 %col_sum_4_load_loc, i24 %col_sum_5_load_loc, i24 %col_sum_6_load_loc, i24 %col_sum_7_load_loc, i24 %col_sum_8_load_loc, i24 %col_sum_9_load_loc, i24 %col_sum_10_load_loc, i24 %col_sum_11_load_loc, i24 %col_sum_12_load_loc, i24 %col_sum_13_load_loc, i24 %col_sum_14_load_loc, i24 %col_sum_15_load_loc, i24 %col_sum_16_load_loc, i24 %col_sum_17_load_loc, i24 %col_sum_18_load_loc, i24 %col_sum_19_load_loc, i24 %col_sum_20_load_loc, i24 %col_sum_21_load_loc, i24 %col_sum_22_load_loc, i24 %col_sum_23_load_loc, i24 %col_sum_24_load_loc, i24 %col_sum_25_load_loc, i24 %col_sum_26_load_loc, i24 %col_sum_27_load_loc, i24 %col_sum_28_load_loc, i24 %col_sum_29_load_loc, i24 %col_sum_30_load_loc, i24 %col_sum_31_load_loc, i24 %col_sum_32_load_loc, i24 %col_sum_33_load_loc, i24 %col_sum_34_load_loc, i24 %col_sum_35_load_loc, i24 %col_sum_36_load_loc, i24 %col_sum_37_load_loc, i24 %col_sum_38_load_loc, i24 %col_sum_39_load_loc, i24 %col_sum_40_load_loc, i24 %col_sum_41_load_loc, i24 %col_sum_42_load_loc, i24 %col_sum_43_load_loc, i24 %col_sum_44_load_loc, i24 %col_sum_45_load_loc, i24 %col_sum_46_load_loc, i24 %col_sum_47_load_loc, i24 %col_sum_48_load_loc, i24 %col_sum_49_load_loc, i24 %col_sum_50_load_loc, i24 %col_sum_51_load_loc, i24 %col_sum_52_load_loc, i24 %col_sum_53_load_loc, i24 %col_sum_54_load_loc, i24 %col_sum_55_load_loc, i24 %col_sum_56_load_loc, i24 %col_sum_57_load_loc, i24 %col_sum_58_load_loc, i24 %col_sum_59_load_loc, i24 %col_sum_60_load_loc, i24 %col_sum_61_load_loc, i24 %col_sum_62_load_loc, i24 %col_sum_63_load_loc, i24 %top_kernel_ap_fixed_64_ap_fixed_24_8_0_0_0_64_A_loc, i24 %top_kernel_ap_fixed_64_ap_fixed_24_8_0_0_0_64_tmp_2, i24 %top_kernel_ap_fixed_64_ap_fixed_24_8_0_0_0_64_A_loc_1, i24 %top_kernel_ap_fixed_64_ap_fixed_24_8_0_0_0_64_tmp_3, i24 %top_kernel_ap_fixed_64_ap_fixed_24_8_0_0_0_64_A_loc_2, i24 %top_kernel_ap_fixed_64_ap_fixed_24_8_0_0_0_64_tmp_4, i24 %top_kernel_ap_fixed_64_ap_fixed_24_8_0_0_0_64_A_loc_3, i24 %top_kernel_ap_fixed_64_ap_fixed_24_8_0_0_0_64_tmp_5, i24 %top_kernel_ap_fixed_64_ap_fixed_24_8_0_0_0_64_A_loc_4, i24 %top_kernel_ap_fixed_64_ap_fixed_24_8_0_0_0_64_tmp_6, i24 %top_kernel_ap_fixed_64_ap_fixed_24_8_0_0_0_64_A_loc_5, i24 %top_kernel_ap_fixed_64_ap_fixed_24_8_0_0_0_64_tmp, i24 %top_kernel_ap_fixed_64_ap_fixed_24_8_0_0_0_64_A_loc_6, i24 %top_kernel_ap_fixed_64_ap_fixed_24_8_0_0_0_64_tmp_1, i24 %denom_row, i24 %top_kernel_ap_fixed_64_ap_fixed_24_8_0_0_0_64_A_loc_7, i24 %top_kernel_ap_fixed_64_ap_fixed_24_8_0_0_0_64_tmp_7"   --->   Operation 139 'call' 'call_ln0' <Predicate = true> <Delay = 0.00> <CoreType = "Generic">   --->   Generic Core

State 4 <SV = 3> <Delay = 0.00>
ST_4 : Operation 140 [1/2] (0.00ns)   --->   "%call_ln0 = call void @top_kernel_Pipeline_VITIS_LOOP_59_4, i24 %col_sum_load_loc, i24 %col_sum_1_load_loc, i24 %col_sum_2_load_loc, i24 %col_sum_3_load_loc, i24 %col_sum_4_load_loc, i24 %col_sum_5_load_loc, i24 %col_sum_6_load_loc, i24 %col_sum_7_load_loc, i24 %col_sum_8_load_loc, i24 %col_sum_9_load_loc, i24 %col_sum_10_load_loc, i24 %col_sum_11_load_loc, i24 %col_sum_12_load_loc, i24 %col_sum_13_load_loc, i24 %col_sum_14_load_loc, i24 %col_sum_15_load_loc, i24 %col_sum_16_load_loc, i24 %col_sum_17_load_loc, i24 %col_sum_18_load_loc, i24 %col_sum_19_load_loc, i24 %col_sum_20_load_loc, i24 %col_sum_21_load_loc, i24 %col_sum_22_load_loc, i24 %col_sum_23_load_loc, i24 %col_sum_24_load_loc, i24 %col_sum_25_load_loc, i24 %col_sum_26_load_loc, i24 %col_sum_27_load_loc, i24 %col_sum_28_load_loc, i24 %col_sum_29_load_loc, i24 %col_sum_30_load_loc, i24 %col_sum_31_load_loc, i24 %col_sum_32_load_loc, i24 %col_sum_33_load_loc, i24 %col_sum_34_load_loc, i24 %col_sum_35_load_loc, i24 %col_sum_36_load_loc, i24 %col_sum_37_load_loc, i24 %col_sum_38_load_loc, i24 %col_sum_39_load_loc, i24 %col_sum_40_load_loc, i24 %col_sum_41_load_loc, i24 %col_sum_42_load_loc, i24 %col_sum_43_load_loc, i24 %col_sum_44_load_loc, i24 %col_sum_45_load_loc, i24 %col_sum_46_load_loc, i24 %col_sum_47_load_loc, i24 %col_sum_48_load_loc, i24 %col_sum_49_load_loc, i24 %col_sum_50_load_loc, i24 %col_sum_51_load_loc, i24 %col_sum_52_load_loc, i24 %col_sum_53_load_loc, i24 %col_sum_54_load_loc, i24 %col_sum_55_load_loc, i24 %col_sum_56_load_loc, i24 %col_sum_57_load_loc, i24 %col_sum_58_load_loc, i24 %col_sum_59_load_loc, i24 %col_sum_60_load_loc, i24 %col_sum_61_load_loc, i24 %col_sum_62_load_loc, i24 %col_sum_63_load_loc, i24 %top_kernel_ap_fixed_64_ap_fixed_24_8_0_0_0_64_A_loc, i24 %top_kernel_ap_fixed_64_ap_fixed_24_8_0_0_0_64_tmp_2, i24 %top_kernel_ap_fixed_64_ap_fixed_24_8_0_0_0_64_A_loc_1, i24 %top_kernel_ap_fixed_64_ap_fixed_24_8_0_0_0_64_tmp_3, i24 %top_kernel_ap_fixed_64_ap_fixed_24_8_0_0_0_64_A_loc_2, i24 %top_kernel_ap_fixed_64_ap_fixed_24_8_0_0_0_64_tmp_4, i24 %top_kernel_ap_fixed_64_ap_fixed_24_8_0_0_0_64_A_loc_3, i24 %top_kernel_ap_fixed_64_ap_fixed_24_8_0_0_0_64_tmp_5, i24 %top_kernel_ap_fixed_64_ap_fixed_24_8_0_0_0_64_A_loc_4, i24 %top_kernel_ap_fixed_64_ap_fixed_24_8_0_0_0_64_tmp_6, i24 %top_kernel_ap_fixed_64_ap_fixed_24_8_0_0_0_64_A_loc_5, i24 %top_kernel_ap_fixed_64_ap_fixed_24_8_0_0_0_64_tmp, i24 %top_kernel_ap_fixed_64_ap_fixed_24_8_0_0_0_64_A_loc_6, i24 %top_kernel_ap_fixed_64_ap_fixed_24_8_0_0_0_64_tmp_1, i24 %denom_row, i24 %top_kernel_ap_fixed_64_ap_fixed_24_8_0_0_0_64_A_loc_7, i24 %top_kernel_ap_fixed_64_ap_fixed_24_8_0_0_0_64_tmp_7"   --->   Operation 140 'call' 'call_ln0' <Predicate = true> <Delay = 0.00> <CoreType = "Generic">   --->   Generic Core

State 5 <SV = 4> <Delay = 5.10>
ST_5 : Operation 141 [1/1] (0.00ns)   --->   "%col_sum_load = load i24 %col_sum_load_loc"   --->   Operation 141 'load' 'col_sum_load' <Predicate = true> <Delay = 0.00>
ST_5 : Operation 142 [1/1] (0.00ns)   --->   "%col_sum_1_load = load i24 %col_sum_1_load_loc"   --->   Operation 142 'load' 'col_sum_1_load' <Predicate = true> <Delay = 0.00>
ST_5 : Operation 143 [1/1] (0.00ns)   --->   "%col_sum_2_load = load i24 %col_sum_2_load_loc"   --->   Operation 143 'load' 'col_sum_2_load' <Predicate = true> <Delay = 0.00>
ST_5 : Operation 144 [1/1] (0.00ns)   --->   "%col_sum_3_load = load i24 %col_sum_3_load_loc"   --->   Operation 144 'load' 'col_sum_3_load' <Predicate = true> <Delay = 0.00>
ST_5 : Operation 145 [1/1] (0.00ns)   --->   "%col_sum_4_load = load i24 %col_sum_4_load_loc"   --->   Operation 145 'load' 'col_sum_4_load' <Predicate = true> <Delay = 0.00>
ST_5 : Operation 146 [1/1] (0.00ns)   --->   "%col_sum_5_load = load i24 %col_sum_5_load_loc"   --->   Operation 146 'load' 'col_sum_5_load' <Predicate = true> <Delay = 0.00>
ST_5 : Operation 147 [1/1] (0.00ns)   --->   "%col_sum_6_load = load i24 %col_sum_6_load_loc"   --->   Operation 147 'load' 'col_sum_6_load' <Predicate = true> <Delay = 0.00>
ST_5 : Operation 148 [1/1] (0.00ns)   --->   "%col_sum_7_load = load i24 %col_sum_7_load_loc"   --->   Operation 148 'load' 'col_sum_7_load' <Predicate = true> <Delay = 0.00>
ST_5 : Operation 149 [1/1] (0.00ns)   --->   "%col_sum_8_load = load i24 %col_sum_8_load_loc"   --->   Operation 149 'load' 'col_sum_8_load' <Predicate = true> <Delay = 0.00>
ST_5 : Operation 150 [1/1] (0.00ns)   --->   "%col_sum_9_load = load i24 %col_sum_9_load_loc"   --->   Operation 150 'load' 'col_sum_9_load' <Predicate = true> <Delay = 0.00>
ST_5 : Operation 151 [1/1] (0.00ns)   --->   "%col_sum_10_load = load i24 %col_sum_10_load_loc"   --->   Operation 151 'load' 'col_sum_10_load' <Predicate = true> <Delay = 0.00>
ST_5 : Operation 152 [1/1] (0.00ns)   --->   "%col_sum_11_load = load i24 %col_sum_11_load_loc"   --->   Operation 152 'load' 'col_sum_11_load' <Predicate = true> <Delay = 0.00>
ST_5 : Operation 153 [1/1] (0.00ns)   --->   "%col_sum_12_load = load i24 %col_sum_12_load_loc"   --->   Operation 153 'load' 'col_sum_12_load' <Predicate = true> <Delay = 0.00>
ST_5 : Operation 154 [1/1] (0.00ns)   --->   "%col_sum_13_load = load i24 %col_sum_13_load_loc"   --->   Operation 154 'load' 'col_sum_13_load' <Predicate = true> <Delay = 0.00>
ST_5 : Operation 155 [1/1] (0.00ns)   --->   "%col_sum_14_load = load i24 %col_sum_14_load_loc"   --->   Operation 155 'load' 'col_sum_14_load' <Predicate = true> <Delay = 0.00>
ST_5 : Operation 156 [1/1] (0.00ns)   --->   "%col_sum_15_load = load i24 %col_sum_15_load_loc"   --->   Operation 156 'load' 'col_sum_15_load' <Predicate = true> <Delay = 0.00>
ST_5 : Operation 157 [1/1] (0.00ns)   --->   "%col_sum_16_load = load i24 %col_sum_16_load_loc"   --->   Operation 157 'load' 'col_sum_16_load' <Predicate = true> <Delay = 0.00>
ST_5 : Operation 158 [1/1] (0.00ns)   --->   "%col_sum_17_load = load i24 %col_sum_17_load_loc"   --->   Operation 158 'load' 'col_sum_17_load' <Predicate = true> <Delay = 0.00>
ST_5 : Operation 159 [1/1] (0.00ns)   --->   "%col_sum_18_load = load i24 %col_sum_18_load_loc"   --->   Operation 159 'load' 'col_sum_18_load' <Predicate = true> <Delay = 0.00>
ST_5 : Operation 160 [1/1] (0.00ns)   --->   "%col_sum_19_load = load i24 %col_sum_19_load_loc"   --->   Operation 160 'load' 'col_sum_19_load' <Predicate = true> <Delay = 0.00>
ST_5 : Operation 161 [1/1] (0.00ns)   --->   "%col_sum_20_load = load i24 %col_sum_20_load_loc"   --->   Operation 161 'load' 'col_sum_20_load' <Predicate = true> <Delay = 0.00>
ST_5 : Operation 162 [1/1] (0.00ns)   --->   "%col_sum_21_load = load i24 %col_sum_21_load_loc"   --->   Operation 162 'load' 'col_sum_21_load' <Predicate = true> <Delay = 0.00>
ST_5 : Operation 163 [1/1] (0.00ns)   --->   "%col_sum_22_load = load i24 %col_sum_22_load_loc"   --->   Operation 163 'load' 'col_sum_22_load' <Predicate = true> <Delay = 0.00>
ST_5 : Operation 164 [1/1] (0.00ns)   --->   "%col_sum_23_load = load i24 %col_sum_23_load_loc"   --->   Operation 164 'load' 'col_sum_23_load' <Predicate = true> <Delay = 0.00>
ST_5 : Operation 165 [1/1] (0.00ns)   --->   "%col_sum_24_load = load i24 %col_sum_24_load_loc"   --->   Operation 165 'load' 'col_sum_24_load' <Predicate = true> <Delay = 0.00>
ST_5 : Operation 166 [1/1] (0.00ns)   --->   "%col_sum_25_load = load i24 %col_sum_25_load_loc"   --->   Operation 166 'load' 'col_sum_25_load' <Predicate = true> <Delay = 0.00>
ST_5 : Operation 167 [1/1] (0.00ns)   --->   "%col_sum_26_load = load i24 %col_sum_26_load_loc"   --->   Operation 167 'load' 'col_sum_26_load' <Predicate = true> <Delay = 0.00>
ST_5 : Operation 168 [1/1] (0.00ns)   --->   "%col_sum_27_load = load i24 %col_sum_27_load_loc"   --->   Operation 168 'load' 'col_sum_27_load' <Predicate = true> <Delay = 0.00>
ST_5 : Operation 169 [1/1] (0.00ns)   --->   "%col_sum_28_load = load i24 %col_sum_28_load_loc"   --->   Operation 169 'load' 'col_sum_28_load' <Predicate = true> <Delay = 0.00>
ST_5 : Operation 170 [1/1] (0.00ns)   --->   "%col_sum_29_load = load i24 %col_sum_29_load_loc"   --->   Operation 170 'load' 'col_sum_29_load' <Predicate = true> <Delay = 0.00>
ST_5 : Operation 171 [1/1] (0.00ns)   --->   "%col_sum_30_load = load i24 %col_sum_30_load_loc"   --->   Operation 171 'load' 'col_sum_30_load' <Predicate = true> <Delay = 0.00>
ST_5 : Operation 172 [1/1] (0.00ns)   --->   "%col_sum_31_load = load i24 %col_sum_31_load_loc"   --->   Operation 172 'load' 'col_sum_31_load' <Predicate = true> <Delay = 0.00>
ST_5 : Operation 173 [1/1] (0.00ns)   --->   "%col_sum_32_load = load i24 %col_sum_32_load_loc"   --->   Operation 173 'load' 'col_sum_32_load' <Predicate = true> <Delay = 0.00>
ST_5 : Operation 174 [1/1] (0.00ns)   --->   "%col_sum_33_load = load i24 %col_sum_33_load_loc"   --->   Operation 174 'load' 'col_sum_33_load' <Predicate = true> <Delay = 0.00>
ST_5 : Operation 175 [1/1] (0.00ns)   --->   "%col_sum_34_load = load i24 %col_sum_34_load_loc"   --->   Operation 175 'load' 'col_sum_34_load' <Predicate = true> <Delay = 0.00>
ST_5 : Operation 176 [1/1] (0.00ns)   --->   "%col_sum_35_load = load i24 %col_sum_35_load_loc"   --->   Operation 176 'load' 'col_sum_35_load' <Predicate = true> <Delay = 0.00>
ST_5 : Operation 177 [1/1] (0.00ns)   --->   "%col_sum_36_load = load i24 %col_sum_36_load_loc"   --->   Operation 177 'load' 'col_sum_36_load' <Predicate = true> <Delay = 0.00>
ST_5 : Operation 178 [1/1] (0.00ns)   --->   "%col_sum_37_load = load i24 %col_sum_37_load_loc"   --->   Operation 178 'load' 'col_sum_37_load' <Predicate = true> <Delay = 0.00>
ST_5 : Operation 179 [1/1] (0.00ns)   --->   "%col_sum_38_load = load i24 %col_sum_38_load_loc"   --->   Operation 179 'load' 'col_sum_38_load' <Predicate = true> <Delay = 0.00>
ST_5 : Operation 180 [1/1] (0.00ns)   --->   "%col_sum_39_load = load i24 %col_sum_39_load_loc"   --->   Operation 180 'load' 'col_sum_39_load' <Predicate = true> <Delay = 0.00>
ST_5 : Operation 181 [1/1] (0.00ns)   --->   "%col_sum_40_load = load i24 %col_sum_40_load_loc"   --->   Operation 181 'load' 'col_sum_40_load' <Predicate = true> <Delay = 0.00>
ST_5 : Operation 182 [1/1] (0.00ns)   --->   "%col_sum_41_load = load i24 %col_sum_41_load_loc"   --->   Operation 182 'load' 'col_sum_41_load' <Predicate = true> <Delay = 0.00>
ST_5 : Operation 183 [1/1] (0.00ns)   --->   "%col_sum_42_load = load i24 %col_sum_42_load_loc"   --->   Operation 183 'load' 'col_sum_42_load' <Predicate = true> <Delay = 0.00>
ST_5 : Operation 184 [1/1] (0.00ns)   --->   "%col_sum_43_load = load i24 %col_sum_43_load_loc"   --->   Operation 184 'load' 'col_sum_43_load' <Predicate = true> <Delay = 0.00>
ST_5 : Operation 185 [1/1] (0.00ns)   --->   "%col_sum_44_load = load i24 %col_sum_44_load_loc"   --->   Operation 185 'load' 'col_sum_44_load' <Predicate = true> <Delay = 0.00>
ST_5 : Operation 186 [1/1] (0.00ns)   --->   "%col_sum_45_load = load i24 %col_sum_45_load_loc"   --->   Operation 186 'load' 'col_sum_45_load' <Predicate = true> <Delay = 0.00>
ST_5 : Operation 187 [1/1] (0.00ns)   --->   "%col_sum_46_load = load i24 %col_sum_46_load_loc"   --->   Operation 187 'load' 'col_sum_46_load' <Predicate = true> <Delay = 0.00>
ST_5 : Operation 188 [1/1] (0.00ns)   --->   "%col_sum_47_load = load i24 %col_sum_47_load_loc"   --->   Operation 188 'load' 'col_sum_47_load' <Predicate = true> <Delay = 0.00>
ST_5 : Operation 189 [1/1] (0.00ns)   --->   "%col_sum_48_load = load i24 %col_sum_48_load_loc"   --->   Operation 189 'load' 'col_sum_48_load' <Predicate = true> <Delay = 0.00>
ST_5 : Operation 190 [1/1] (0.00ns)   --->   "%col_sum_49_load = load i24 %col_sum_49_load_loc"   --->   Operation 190 'load' 'col_sum_49_load' <Predicate = true> <Delay = 0.00>
ST_5 : Operation 191 [1/1] (0.00ns)   --->   "%col_sum_50_load = load i24 %col_sum_50_load_loc"   --->   Operation 191 'load' 'col_sum_50_load' <Predicate = true> <Delay = 0.00>
ST_5 : Operation 192 [1/1] (0.00ns)   --->   "%col_sum_51_load = load i24 %col_sum_51_load_loc"   --->   Operation 192 'load' 'col_sum_51_load' <Predicate = true> <Delay = 0.00>
ST_5 : Operation 193 [1/1] (0.00ns)   --->   "%col_sum_52_load = load i24 %col_sum_52_load_loc"   --->   Operation 193 'load' 'col_sum_52_load' <Predicate = true> <Delay = 0.00>
ST_5 : Operation 194 [1/1] (0.00ns)   --->   "%col_sum_53_load = load i24 %col_sum_53_load_loc"   --->   Operation 194 'load' 'col_sum_53_load' <Predicate = true> <Delay = 0.00>
ST_5 : Operation 195 [1/1] (0.00ns)   --->   "%col_sum_54_load = load i24 %col_sum_54_load_loc"   --->   Operation 195 'load' 'col_sum_54_load' <Predicate = true> <Delay = 0.00>
ST_5 : Operation 196 [1/1] (0.00ns)   --->   "%col_sum_55_load = load i24 %col_sum_55_load_loc"   --->   Operation 196 'load' 'col_sum_55_load' <Predicate = true> <Delay = 0.00>
ST_5 : Operation 197 [1/1] (0.00ns)   --->   "%col_sum_56_load = load i24 %col_sum_56_load_loc"   --->   Operation 197 'load' 'col_sum_56_load' <Predicate = true> <Delay = 0.00>
ST_5 : Operation 198 [1/1] (0.00ns)   --->   "%col_sum_57_load = load i24 %col_sum_57_load_loc"   --->   Operation 198 'load' 'col_sum_57_load' <Predicate = true> <Delay = 0.00>
ST_5 : Operation 199 [1/1] (0.00ns)   --->   "%col_sum_58_load = load i24 %col_sum_58_load_loc"   --->   Operation 199 'load' 'col_sum_58_load' <Predicate = true> <Delay = 0.00>
ST_5 : Operation 200 [1/1] (0.00ns)   --->   "%col_sum_59_load = load i24 %col_sum_59_load_loc"   --->   Operation 200 'load' 'col_sum_59_load' <Predicate = true> <Delay = 0.00>
ST_5 : Operation 201 [1/1] (0.00ns)   --->   "%col_sum_60_load = load i24 %col_sum_60_load_loc"   --->   Operation 201 'load' 'col_sum_60_load' <Predicate = true> <Delay = 0.00>
ST_5 : Operation 202 [1/1] (0.00ns)   --->   "%col_sum_61_load = load i24 %col_sum_61_load_loc"   --->   Operation 202 'load' 'col_sum_61_load' <Predicate = true> <Delay = 0.00>
ST_5 : Operation 203 [1/1] (0.00ns)   --->   "%col_sum_62_load = load i24 %col_sum_62_load_loc"   --->   Operation 203 'load' 'col_sum_62_load' <Predicate = true> <Delay = 0.00>
ST_5 : Operation 204 [1/1] (0.00ns)   --->   "%col_sum_63_load = load i24 %col_sum_63_load_loc"   --->   Operation 204 'load' 'col_sum_63_load' <Predicate = true> <Delay = 0.00>
ST_5 : Operation 205 [2/2] (5.10ns)   --->   "%call_ln0 = call void @top_kernel_Pipeline_VITIS_LOOP_78_6, i24 %col_sum_load, i24 %col_sum_8_load, i24 %col_sum_16_load, i24 %col_sum_24_load, i24 %col_sum_32_load, i24 %col_sum_40_load, i24 %col_sum_48_load, i24 %col_sum_56_load, i24 %col_sum_1_load, i24 %col_sum_9_load, i24 %col_sum_17_load, i24 %col_sum_25_load, i24 %col_sum_33_load, i24 %col_sum_41_load, i24 %col_sum_49_load, i24 %col_sum_57_load, i24 %col_sum_2_load, i24 %col_sum_10_load, i24 %col_sum_18_load, i24 %col_sum_26_load, i24 %col_sum_34_load, i24 %col_sum_42_load, i24 %col_sum_50_load, i24 %col_sum_58_load, i24 %col_sum_3_load, i24 %col_sum_11_load, i24 %col_sum_19_load, i24 %col_sum_27_load, i24 %col_sum_35_load, i24 %col_sum_43_load, i24 %col_sum_51_load, i24 %col_sum_59_load, i24 %col_sum_4_load, i24 %col_sum_12_load, i24 %col_sum_20_load, i24 %col_sum_28_load, i24 %col_sum_36_load, i24 %col_sum_44_load, i24 %col_sum_52_load, i24 %col_sum_60_load, i24 %col_sum_5_load, i24 %col_sum_13_load, i24 %col_sum_21_load, i24 %col_sum_29_load, i24 %col_sum_37_load, i24 %col_sum_45_load, i24 %col_sum_53_load, i24 %col_sum_61_load, i24 %col_sum_6_load, i24 %col_sum_14_load, i24 %col_sum_22_load, i24 %col_sum_30_load, i24 %col_sum_38_load, i24 %col_sum_46_load, i24 %col_sum_54_load, i24 %col_sum_62_load, i24 %col_sum_7_load, i24 %col_sum_15_load, i24 %col_sum_23_load, i24 %col_sum_31_load, i24 %col_sum_39_load, i24 %col_sum_47_load, i24 %col_sum_55_load, i24 %col_sum_63_load, i24 %scale_63_loc, i24 %scale_62_loc, i24 %scale_61_loc, i24 %scale_60_loc, i24 %scale_59_loc, i24 %scale_58_loc, i24 %scale_57_loc, i24 %scale_56_loc, i24 %scale_55_loc, i24 %scale_54_loc, i24 %scale_53_loc, i24 %scale_52_loc, i24 %scale_51_loc, i24 %scale_50_loc, i24 %scale_49_loc, i24 %scale_48_loc, i24 %scale_47_loc, i24 %scale_46_loc, i24 %scale_45_loc, i24 %scale_44_loc, i24 %scale_43_loc, i24 %scale_42_loc, i24 %scale_41_loc, i24 %scale_40_loc, i24 %scale_39_loc, i24 %scale_38_loc, i24 %scale_37_loc, i24 %scale_36_loc, i24 %scale_35_loc, i24 %scale_34_loc, i24 %scale_33_loc, i24 %scale_32_loc, i24 %scale_31_loc, i24 %scale_30_loc, i24 %scale_29_loc, i24 %scale_28_loc, i24 %scale_27_loc, i24 %scale_26_loc, i24 %scale_25_loc, i24 %scale_24_loc, i24 %scale_23_loc, i24 %scale_22_loc, i24 %scale_21_loc, i24 %scale_20_loc, i24 %scale_19_loc, i24 %scale_18_loc, i24 %scale_17_loc, i24 %scale_16_loc, i24 %scale_15_loc, i24 %scale_14_loc, i24 %scale_13_loc, i24 %scale_12_loc, i24 %scale_11_loc, i24 %scale_10_loc, i24 %scale_9_loc, i24 %scale_8_loc, i24 %scale_7_loc, i24 %scale_6_loc, i24 %scale_5_loc, i24 %scale_4_loc, i24 %scale_3_loc, i24 %scale_2_loc, i24 %scale_1_loc, i24 %scale_loc"   --->   Operation 205 'call' 'call_ln0' <Predicate = true> <Delay = 5.10> <CoreType = "Generic">   --->   Generic Core

State 6 <SV = 5> <Delay = 0.97>
ST_6 : Operation 206 [1/2] (0.97ns)   --->   "%call_ln0 = call void @top_kernel_Pipeline_VITIS_LOOP_78_6, i24 %col_sum_load, i24 %col_sum_8_load, i24 %col_sum_16_load, i24 %col_sum_24_load, i24 %col_sum_32_load, i24 %col_sum_40_load, i24 %col_sum_48_load, i24 %col_sum_56_load, i24 %col_sum_1_load, i24 %col_sum_9_load, i24 %col_sum_17_load, i24 %col_sum_25_load, i24 %col_sum_33_load, i24 %col_sum_41_load, i24 %col_sum_49_load, i24 %col_sum_57_load, i24 %col_sum_2_load, i24 %col_sum_10_load, i24 %col_sum_18_load, i24 %col_sum_26_load, i24 %col_sum_34_load, i24 %col_sum_42_load, i24 %col_sum_50_load, i24 %col_sum_58_load, i24 %col_sum_3_load, i24 %col_sum_11_load, i24 %col_sum_19_load, i24 %col_sum_27_load, i24 %col_sum_35_load, i24 %col_sum_43_load, i24 %col_sum_51_load, i24 %col_sum_59_load, i24 %col_sum_4_load, i24 %col_sum_12_load, i24 %col_sum_20_load, i24 %col_sum_28_load, i24 %col_sum_36_load, i24 %col_sum_44_load, i24 %col_sum_52_load, i24 %col_sum_60_load, i24 %col_sum_5_load, i24 %col_sum_13_load, i24 %col_sum_21_load, i24 %col_sum_29_load, i24 %col_sum_37_load, i24 %col_sum_45_load, i24 %col_sum_53_load, i24 %col_sum_61_load, i24 %col_sum_6_load, i24 %col_sum_14_load, i24 %col_sum_22_load, i24 %col_sum_30_load, i24 %col_sum_38_load, i24 %col_sum_46_load, i24 %col_sum_54_load, i24 %col_sum_62_load, i24 %col_sum_7_load, i24 %col_sum_15_load, i24 %col_sum_23_load, i24 %col_sum_31_load, i24 %col_sum_39_load, i24 %col_sum_47_load, i24 %col_sum_55_load, i24 %col_sum_63_load, i24 %scale_63_loc, i24 %scale_62_loc, i24 %scale_61_loc, i24 %scale_60_loc, i24 %scale_59_loc, i24 %scale_58_loc, i24 %scale_57_loc, i24 %scale_56_loc, i24 %scale_55_loc, i24 %scale_54_loc, i24 %scale_53_loc, i24 %scale_52_loc, i24 %scale_51_loc, i24 %scale_50_loc, i24 %scale_49_loc, i24 %scale_48_loc, i24 %scale_47_loc, i24 %scale_46_loc, i24 %scale_45_loc, i24 %scale_44_loc, i24 %scale_43_loc, i24 %scale_42_loc, i24 %scale_41_loc, i24 %scale_40_loc, i24 %scale_39_loc, i24 %scale_38_loc, i24 %scale_37_loc, i24 %scale_36_loc, i24 %scale_35_loc, i24 %scale_34_loc, i24 %scale_33_loc, i24 %scale_32_loc, i24 %scale_31_loc, i24 %scale_30_loc, i24 %scale_29_loc, i24 %scale_28_loc, i24 %scale_27_loc, i24 %scale_26_loc, i24 %scale_25_loc, i24 %scale_24_loc, i24 %scale_23_loc, i24 %scale_22_loc, i24 %scale_21_loc, i24 %scale_20_loc, i24 %scale_19_loc, i24 %scale_18_loc, i24 %scale_17_loc, i24 %scale_16_loc, i24 %scale_15_loc, i24 %scale_14_loc, i24 %scale_13_loc, i24 %scale_12_loc, i24 %scale_11_loc, i24 %scale_10_loc, i24 %scale_9_loc, i24 %scale_8_loc, i24 %scale_7_loc, i24 %scale_6_loc, i24 %scale_5_loc, i24 %scale_4_loc, i24 %scale_3_loc, i24 %scale_2_loc, i24 %scale_1_loc, i24 %scale_loc"   --->   Operation 206 'call' 'call_ln0' <Predicate = true> <Delay = 0.97> <CoreType = "Generic">   --->   Generic Core

State 7 <SV = 6> <Delay = 0.93>
ST_7 : Operation 207 [1/1] (0.00ns)   --->   "%scale_63_loc_load = load i24 %scale_63_loc"   --->   Operation 207 'load' 'scale_63_loc_load' <Predicate = true> <Delay = 0.00>
ST_7 : Operation 208 [1/1] (0.00ns)   --->   "%scale_62_loc_load = load i24 %scale_62_loc"   --->   Operation 208 'load' 'scale_62_loc_load' <Predicate = true> <Delay = 0.00>
ST_7 : Operation 209 [1/1] (0.00ns)   --->   "%scale_61_loc_load = load i24 %scale_61_loc"   --->   Operation 209 'load' 'scale_61_loc_load' <Predicate = true> <Delay = 0.00>
ST_7 : Operation 210 [1/1] (0.00ns)   --->   "%scale_60_loc_load = load i24 %scale_60_loc"   --->   Operation 210 'load' 'scale_60_loc_load' <Predicate = true> <Delay = 0.00>
ST_7 : Operation 211 [1/1] (0.00ns)   --->   "%scale_59_loc_load = load i24 %scale_59_loc"   --->   Operation 211 'load' 'scale_59_loc_load' <Predicate = true> <Delay = 0.00>
ST_7 : Operation 212 [1/1] (0.00ns)   --->   "%scale_58_loc_load = load i24 %scale_58_loc"   --->   Operation 212 'load' 'scale_58_loc_load' <Predicate = true> <Delay = 0.00>
ST_7 : Operation 213 [1/1] (0.00ns)   --->   "%scale_57_loc_load = load i24 %scale_57_loc"   --->   Operation 213 'load' 'scale_57_loc_load' <Predicate = true> <Delay = 0.00>
ST_7 : Operation 214 [1/1] (0.00ns)   --->   "%scale_56_loc_load = load i24 %scale_56_loc"   --->   Operation 214 'load' 'scale_56_loc_load' <Predicate = true> <Delay = 0.00>
ST_7 : Operation 215 [1/1] (0.00ns)   --->   "%scale_55_loc_load = load i24 %scale_55_loc"   --->   Operation 215 'load' 'scale_55_loc_load' <Predicate = true> <Delay = 0.00>
ST_7 : Operation 216 [1/1] (0.00ns)   --->   "%scale_54_loc_load = load i24 %scale_54_loc"   --->   Operation 216 'load' 'scale_54_loc_load' <Predicate = true> <Delay = 0.00>
ST_7 : Operation 217 [1/1] (0.00ns)   --->   "%scale_53_loc_load = load i24 %scale_53_loc"   --->   Operation 217 'load' 'scale_53_loc_load' <Predicate = true> <Delay = 0.00>
ST_7 : Operation 218 [1/1] (0.00ns)   --->   "%scale_52_loc_load = load i24 %scale_52_loc"   --->   Operation 218 'load' 'scale_52_loc_load' <Predicate = true> <Delay = 0.00>
ST_7 : Operation 219 [1/1] (0.00ns)   --->   "%scale_51_loc_load = load i24 %scale_51_loc"   --->   Operation 219 'load' 'scale_51_loc_load' <Predicate = true> <Delay = 0.00>
ST_7 : Operation 220 [1/1] (0.00ns)   --->   "%scale_50_loc_load = load i24 %scale_50_loc"   --->   Operation 220 'load' 'scale_50_loc_load' <Predicate = true> <Delay = 0.00>
ST_7 : Operation 221 [1/1] (0.00ns)   --->   "%scale_49_loc_load = load i24 %scale_49_loc"   --->   Operation 221 'load' 'scale_49_loc_load' <Predicate = true> <Delay = 0.00>
ST_7 : Operation 222 [1/1] (0.00ns)   --->   "%scale_48_loc_load = load i24 %scale_48_loc"   --->   Operation 222 'load' 'scale_48_loc_load' <Predicate = true> <Delay = 0.00>
ST_7 : Operation 223 [1/1] (0.00ns)   --->   "%scale_47_loc_load = load i24 %scale_47_loc"   --->   Operation 223 'load' 'scale_47_loc_load' <Predicate = true> <Delay = 0.00>
ST_7 : Operation 224 [1/1] (0.00ns)   --->   "%scale_46_loc_load = load i24 %scale_46_loc"   --->   Operation 224 'load' 'scale_46_loc_load' <Predicate = true> <Delay = 0.00>
ST_7 : Operation 225 [1/1] (0.00ns)   --->   "%scale_45_loc_load = load i24 %scale_45_loc"   --->   Operation 225 'load' 'scale_45_loc_load' <Predicate = true> <Delay = 0.00>
ST_7 : Operation 226 [1/1] (0.00ns)   --->   "%scale_44_loc_load = load i24 %scale_44_loc"   --->   Operation 226 'load' 'scale_44_loc_load' <Predicate = true> <Delay = 0.00>
ST_7 : Operation 227 [1/1] (0.00ns)   --->   "%scale_43_loc_load = load i24 %scale_43_loc"   --->   Operation 227 'load' 'scale_43_loc_load' <Predicate = true> <Delay = 0.00>
ST_7 : Operation 228 [1/1] (0.00ns)   --->   "%scale_42_loc_load = load i24 %scale_42_loc"   --->   Operation 228 'load' 'scale_42_loc_load' <Predicate = true> <Delay = 0.00>
ST_7 : Operation 229 [1/1] (0.00ns)   --->   "%scale_41_loc_load = load i24 %scale_41_loc"   --->   Operation 229 'load' 'scale_41_loc_load' <Predicate = true> <Delay = 0.00>
ST_7 : Operation 230 [1/1] (0.00ns)   --->   "%scale_40_loc_load = load i24 %scale_40_loc"   --->   Operation 230 'load' 'scale_40_loc_load' <Predicate = true> <Delay = 0.00>
ST_7 : Operation 231 [1/1] (0.00ns)   --->   "%scale_39_loc_load = load i24 %scale_39_loc"   --->   Operation 231 'load' 'scale_39_loc_load' <Predicate = true> <Delay = 0.00>
ST_7 : Operation 232 [1/1] (0.00ns)   --->   "%scale_38_loc_load = load i24 %scale_38_loc"   --->   Operation 232 'load' 'scale_38_loc_load' <Predicate = true> <Delay = 0.00>
ST_7 : Operation 233 [1/1] (0.00ns)   --->   "%scale_37_loc_load = load i24 %scale_37_loc"   --->   Operation 233 'load' 'scale_37_loc_load' <Predicate = true> <Delay = 0.00>
ST_7 : Operation 234 [1/1] (0.00ns)   --->   "%scale_36_loc_load = load i24 %scale_36_loc"   --->   Operation 234 'load' 'scale_36_loc_load' <Predicate = true> <Delay = 0.00>
ST_7 : Operation 235 [1/1] (0.00ns)   --->   "%scale_35_loc_load = load i24 %scale_35_loc"   --->   Operation 235 'load' 'scale_35_loc_load' <Predicate = true> <Delay = 0.00>
ST_7 : Operation 236 [1/1] (0.00ns)   --->   "%scale_34_loc_load = load i24 %scale_34_loc"   --->   Operation 236 'load' 'scale_34_loc_load' <Predicate = true> <Delay = 0.00>
ST_7 : Operation 237 [1/1] (0.00ns)   --->   "%scale_33_loc_load = load i24 %scale_33_loc"   --->   Operation 237 'load' 'scale_33_loc_load' <Predicate = true> <Delay = 0.00>
ST_7 : Operation 238 [1/1] (0.00ns)   --->   "%scale_32_loc_load = load i24 %scale_32_loc"   --->   Operation 238 'load' 'scale_32_loc_load' <Predicate = true> <Delay = 0.00>
ST_7 : Operation 239 [1/1] (0.00ns)   --->   "%scale_31_loc_load = load i24 %scale_31_loc"   --->   Operation 239 'load' 'scale_31_loc_load' <Predicate = true> <Delay = 0.00>
ST_7 : Operation 240 [1/1] (0.00ns)   --->   "%scale_30_loc_load = load i24 %scale_30_loc"   --->   Operation 240 'load' 'scale_30_loc_load' <Predicate = true> <Delay = 0.00>
ST_7 : Operation 241 [1/1] (0.00ns)   --->   "%scale_29_loc_load = load i24 %scale_29_loc"   --->   Operation 241 'load' 'scale_29_loc_load' <Predicate = true> <Delay = 0.00>
ST_7 : Operation 242 [1/1] (0.00ns)   --->   "%scale_28_loc_load = load i24 %scale_28_loc"   --->   Operation 242 'load' 'scale_28_loc_load' <Predicate = true> <Delay = 0.00>
ST_7 : Operation 243 [1/1] (0.00ns)   --->   "%scale_27_loc_load = load i24 %scale_27_loc"   --->   Operation 243 'load' 'scale_27_loc_load' <Predicate = true> <Delay = 0.00>
ST_7 : Operation 244 [1/1] (0.00ns)   --->   "%scale_26_loc_load = load i24 %scale_26_loc"   --->   Operation 244 'load' 'scale_26_loc_load' <Predicate = true> <Delay = 0.00>
ST_7 : Operation 245 [1/1] (0.00ns)   --->   "%scale_25_loc_load = load i24 %scale_25_loc"   --->   Operation 245 'load' 'scale_25_loc_load' <Predicate = true> <Delay = 0.00>
ST_7 : Operation 246 [1/1] (0.00ns)   --->   "%scale_24_loc_load = load i24 %scale_24_loc"   --->   Operation 246 'load' 'scale_24_loc_load' <Predicate = true> <Delay = 0.00>
ST_7 : Operation 247 [1/1] (0.00ns)   --->   "%scale_23_loc_load = load i24 %scale_23_loc"   --->   Operation 247 'load' 'scale_23_loc_load' <Predicate = true> <Delay = 0.00>
ST_7 : Operation 248 [1/1] (0.00ns)   --->   "%scale_22_loc_load = load i24 %scale_22_loc"   --->   Operation 248 'load' 'scale_22_loc_load' <Predicate = true> <Delay = 0.00>
ST_7 : Operation 249 [1/1] (0.00ns)   --->   "%scale_21_loc_load = load i24 %scale_21_loc"   --->   Operation 249 'load' 'scale_21_loc_load' <Predicate = true> <Delay = 0.00>
ST_7 : Operation 250 [1/1] (0.00ns)   --->   "%scale_20_loc_load = load i24 %scale_20_loc"   --->   Operation 250 'load' 'scale_20_loc_load' <Predicate = true> <Delay = 0.00>
ST_7 : Operation 251 [1/1] (0.00ns)   --->   "%scale_19_loc_load = load i24 %scale_19_loc"   --->   Operation 251 'load' 'scale_19_loc_load' <Predicate = true> <Delay = 0.00>
ST_7 : Operation 252 [1/1] (0.00ns)   --->   "%scale_18_loc_load = load i24 %scale_18_loc"   --->   Operation 252 'load' 'scale_18_loc_load' <Predicate = true> <Delay = 0.00>
ST_7 : Operation 253 [1/1] (0.00ns)   --->   "%scale_17_loc_load = load i24 %scale_17_loc"   --->   Operation 253 'load' 'scale_17_loc_load' <Predicate = true> <Delay = 0.00>
ST_7 : Operation 254 [1/1] (0.00ns)   --->   "%scale_16_loc_load = load i24 %scale_16_loc"   --->   Operation 254 'load' 'scale_16_loc_load' <Predicate = true> <Delay = 0.00>
ST_7 : Operation 255 [1/1] (0.00ns)   --->   "%scale_15_loc_load = load i24 %scale_15_loc"   --->   Operation 255 'load' 'scale_15_loc_load' <Predicate = true> <Delay = 0.00>
ST_7 : Operation 256 [1/1] (0.00ns)   --->   "%scale_14_loc_load = load i24 %scale_14_loc"   --->   Operation 256 'load' 'scale_14_loc_load' <Predicate = true> <Delay = 0.00>
ST_7 : Operation 257 [1/1] (0.00ns)   --->   "%scale_13_loc_load = load i24 %scale_13_loc"   --->   Operation 257 'load' 'scale_13_loc_load' <Predicate = true> <Delay = 0.00>
ST_7 : Operation 258 [1/1] (0.00ns)   --->   "%scale_12_loc_load = load i24 %scale_12_loc"   --->   Operation 258 'load' 'scale_12_loc_load' <Predicate = true> <Delay = 0.00>
ST_7 : Operation 259 [1/1] (0.00ns)   --->   "%scale_11_loc_load = load i24 %scale_11_loc"   --->   Operation 259 'load' 'scale_11_loc_load' <Predicate = true> <Delay = 0.00>
ST_7 : Operation 260 [1/1] (0.00ns)   --->   "%scale_10_loc_load = load i24 %scale_10_loc"   --->   Operation 260 'load' 'scale_10_loc_load' <Predicate = true> <Delay = 0.00>
ST_7 : Operation 261 [1/1] (0.00ns)   --->   "%scale_9_loc_load = load i24 %scale_9_loc"   --->   Operation 261 'load' 'scale_9_loc_load' <Predicate = true> <Delay = 0.00>
ST_7 : Operation 262 [1/1] (0.00ns)   --->   "%scale_8_loc_load = load i24 %scale_8_loc"   --->   Operation 262 'load' 'scale_8_loc_load' <Predicate = true> <Delay = 0.00>
ST_7 : Operation 263 [1/1] (0.00ns)   --->   "%scale_7_loc_load = load i24 %scale_7_loc"   --->   Operation 263 'load' 'scale_7_loc_load' <Predicate = true> <Delay = 0.00>
ST_7 : Operation 264 [1/1] (0.00ns)   --->   "%scale_6_loc_load = load i24 %scale_6_loc"   --->   Operation 264 'load' 'scale_6_loc_load' <Predicate = true> <Delay = 0.00>
ST_7 : Operation 265 [1/1] (0.00ns)   --->   "%scale_5_loc_load = load i24 %scale_5_loc"   --->   Operation 265 'load' 'scale_5_loc_load' <Predicate = true> <Delay = 0.00>
ST_7 : Operation 266 [1/1] (0.00ns)   --->   "%scale_4_loc_load = load i24 %scale_4_loc"   --->   Operation 266 'load' 'scale_4_loc_load' <Predicate = true> <Delay = 0.00>
ST_7 : Operation 267 [1/1] (0.00ns)   --->   "%scale_3_loc_load = load i24 %scale_3_loc"   --->   Operation 267 'load' 'scale_3_loc_load' <Predicate = true> <Delay = 0.00>
ST_7 : Operation 268 [1/1] (0.00ns)   --->   "%scale_2_loc_load = load i24 %scale_2_loc"   --->   Operation 268 'load' 'scale_2_loc_load' <Predicate = true> <Delay = 0.00>
ST_7 : Operation 269 [1/1] (0.00ns)   --->   "%scale_1_loc_load = load i24 %scale_1_loc"   --->   Operation 269 'load' 'scale_1_loc_load' <Predicate = true> <Delay = 0.00>
ST_7 : Operation 270 [1/1] (0.00ns)   --->   "%scale_loc_load = load i24 %scale_loc"   --->   Operation 270 'load' 'scale_loc_load' <Predicate = true> <Delay = 0.00>
ST_7 : Operation 271 [2/2] (0.93ns)   --->   "%call_ln0 = call void @top_kernel_Pipeline_VITIS_LOOP_90_8, i24 %C, i24 %scale_loc_load, i24 %scale_2_loc_load, i24 %scale_4_loc_load, i24 %scale_6_loc_load, i24 %scale_8_loc_load, i24 %scale_10_loc_load, i24 %scale_12_loc_load, i24 %scale_14_loc_load, i24 %scale_16_loc_load, i24 %scale_18_loc_load, i24 %scale_20_loc_load, i24 %scale_22_loc_load, i24 %scale_24_loc_load, i24 %scale_26_loc_load, i24 %scale_28_loc_load, i24 %scale_30_loc_load, i24 %scale_32_loc_load, i24 %scale_34_loc_load, i24 %scale_36_loc_load, i24 %scale_38_loc_load, i24 %scale_40_loc_load, i24 %scale_42_loc_load, i24 %scale_44_loc_load, i24 %scale_46_loc_load, i24 %scale_48_loc_load, i24 %scale_50_loc_load, i24 %scale_52_loc_load, i24 %scale_54_loc_load, i24 %scale_56_loc_load, i24 %scale_58_loc_load, i24 %scale_60_loc_load, i24 %scale_62_loc_load, i24 %scale_1_loc_load, i24 %scale_3_loc_load, i24 %scale_5_loc_load, i24 %scale_7_loc_load, i24 %scale_9_loc_load, i24 %scale_11_loc_load, i24 %scale_13_loc_load, i24 %scale_15_loc_load, i24 %scale_17_loc_load, i24 %scale_19_loc_load, i24 %scale_21_loc_load, i24 %scale_23_loc_load, i24 %scale_25_loc_load, i24 %scale_27_loc_load, i24 %scale_29_loc_load, i24 %scale_31_loc_load, i24 %scale_33_loc_load, i24 %scale_35_loc_load, i24 %scale_37_loc_load, i24 %scale_39_loc_load, i24 %scale_41_loc_load, i24 %scale_43_loc_load, i24 %scale_45_loc_load, i24 %scale_47_loc_load, i24 %scale_49_loc_load, i24 %scale_51_loc_load, i24 %scale_53_loc_load, i24 %scale_55_loc_load, i24 %scale_57_loc_load, i24 %scale_59_loc_load, i24 %scale_61_loc_load, i24 %scale_63_loc_load, i24 %top_kernel_ap_fixed_64_ap_fixed_24_8_0_0_0_64_tmp_7, i24 %top_kernel_ap_fixed_64_ap_fixed_24_8_0_0_0_64_tmp, i24 %top_kernel_ap_fixed_64_ap_fixed_24_8_0_0_0_64_tmp_5, i24 %top_kernel_ap_fixed_64_ap_fixed_24_8_0_0_0_64_tmp_3, i24 %top_kernel_ap_fixed_64_ap_fixed_24_8_0_0_0_64_tmp_1, i24 %top_kernel_ap_fixed_64_ap_fixed_24_8_0_0_0_64_tmp_6, i24 %top_kernel_ap_fixed_64_ap_fixed_24_8_0_0_0_64_tmp_4, i24 %top_kernel_ap_fixed_64_ap_fixed_24_8_0_0_0_64_tmp_2"   --->   Operation 271 'call' 'call_ln0' <Predicate = true> <Delay = 0.93> <CoreType = "Generic">   --->   Generic Core

State 8 <SV = 7> <Delay = 0.00>
ST_8 : Operation 272 [1/1] (0.00ns)   --->   "%spectopmodule_ln16 = spectopmodule void @_ssdm_op_SpecTopModule, void @empty_2" [top.cpp:16]   --->   Operation 272 'spectopmodule' 'spectopmodule_ln16' <Predicate = true> <Delay = 0.00>
ST_8 : Operation 273 [1/1] (0.00ns)   --->   "%specinterface_ln0 = specinterface void @_ssdm_op_SpecInterface, i24 %A, void @empty_4, i32 0, i32 0, void @empty_3, i32 4294967295, i32 0, void @empty_3, void @empty_3, void @empty_3, i32 0, i32 0, i32 0, i32 0, void @empty_3, void @empty_3, i32 4294967295, i32 0, i32 0"   --->   Operation 273 'specinterface' 'specinterface_ln0' <Predicate = true> <Delay = 0.00>
ST_8 : Operation 274 [1/1] (0.00ns)   --->   "%specbitsmap_ln0 = specbitsmap void @_ssdm_op_SpecBitsMap, i24 %A"   --->   Operation 274 'specbitsmap' 'specbitsmap_ln0' <Predicate = true> <Delay = 0.00>
ST_8 : Operation 275 [1/1] (0.00ns)   --->   "%specinterface_ln0 = specinterface void @_ssdm_op_SpecInterface, i24 %C, void @empty_4, i32 0, i32 0, void @empty_3, i32 4294967295, i32 0, void @empty_3, void @empty_3, void @empty_3, i32 0, i32 0, i32 0, i32 0, void @empty_3, void @empty_3, i32 4294967295, i32 0, i32 0"   --->   Operation 275 'specinterface' 'specinterface_ln0' <Predicate = true> <Delay = 0.00>
ST_8 : Operation 276 [1/1] (0.00ns)   --->   "%specbitsmap_ln0 = specbitsmap void @_ssdm_op_SpecBitsMap, i24 %C"   --->   Operation 276 'specbitsmap' 'specbitsmap_ln0' <Predicate = true> <Delay = 0.00>
ST_8 : Operation 277 [1/1] (0.00ns)   --->   "%specmemcore_ln24 = specmemcore void @_ssdm_op_SpecMemCore, i24 %top_kernel_ap_fixed_64_ap_fixed_24_8_0_0_0_64_A_loc, i64 666, i64 30, i64 18446744073709551615" [top.cpp:24]   --->   Operation 277 'specmemcore' 'specmemcore_ln24' <Predicate = true> <Delay = 0.00>
ST_8 : Operation 278 [1/1] (0.00ns)   --->   "%specmemcore_ln24 = specmemcore void @_ssdm_op_SpecMemCore, i24 %top_kernel_ap_fixed_64_ap_fixed_24_8_0_0_0_64_A_loc_1, i64 666, i64 30, i64 18446744073709551615" [top.cpp:24]   --->   Operation 278 'specmemcore' 'specmemcore_ln24' <Predicate = true> <Delay = 0.00>
ST_8 : Operation 279 [1/1] (0.00ns)   --->   "%specmemcore_ln24 = specmemcore void @_ssdm_op_SpecMemCore, i24 %top_kernel_ap_fixed_64_ap_fixed_24_8_0_0_0_64_A_loc_2, i64 666, i64 30, i64 18446744073709551615" [top.cpp:24]   --->   Operation 279 'specmemcore' 'specmemcore_ln24' <Predicate = true> <Delay = 0.00>
ST_8 : Operation 280 [1/1] (0.00ns)   --->   "%specmemcore_ln24 = specmemcore void @_ssdm_op_SpecMemCore, i24 %top_kernel_ap_fixed_64_ap_fixed_24_8_0_0_0_64_A_loc_3, i64 666, i64 30, i64 18446744073709551615" [top.cpp:24]   --->   Operation 280 'specmemcore' 'specmemcore_ln24' <Predicate = true> <Delay = 0.00>
ST_8 : Operation 281 [1/1] (0.00ns)   --->   "%specmemcore_ln24 = specmemcore void @_ssdm_op_SpecMemCore, i24 %top_kernel_ap_fixed_64_ap_fixed_24_8_0_0_0_64_A_loc_4, i64 666, i64 30, i64 18446744073709551615" [top.cpp:24]   --->   Operation 281 'specmemcore' 'specmemcore_ln24' <Predicate = true> <Delay = 0.00>
ST_8 : Operation 282 [1/1] (0.00ns)   --->   "%specmemcore_ln24 = specmemcore void @_ssdm_op_SpecMemCore, i24 %top_kernel_ap_fixed_64_ap_fixed_24_8_0_0_0_64_A_loc_5, i64 666, i64 30, i64 18446744073709551615" [top.cpp:24]   --->   Operation 282 'specmemcore' 'specmemcore_ln24' <Predicate = true> <Delay = 0.00>
ST_8 : Operation 283 [1/1] (0.00ns)   --->   "%specmemcore_ln24 = specmemcore void @_ssdm_op_SpecMemCore, i24 %top_kernel_ap_fixed_64_ap_fixed_24_8_0_0_0_64_A_loc_6, i64 666, i64 30, i64 18446744073709551615" [top.cpp:24]   --->   Operation 283 'specmemcore' 'specmemcore_ln24' <Predicate = true> <Delay = 0.00>
ST_8 : Operation 284 [1/1] (0.00ns)   --->   "%specmemcore_ln24 = specmemcore void @_ssdm_op_SpecMemCore, i24 %top_kernel_ap_fixed_64_ap_fixed_24_8_0_0_0_64_A_loc_7, i64 666, i64 30, i64 18446744073709551615" [top.cpp:24]   --->   Operation 284 'specmemcore' 'specmemcore_ln24' <Predicate = true> <Delay = 0.00>
ST_8 : Operation 285 [1/1] (0.00ns)   --->   "%specmemcore_ln25 = specmemcore void @_ssdm_op_SpecMemCore, i24 %top_kernel_ap_fixed_64_ap_fixed_24_8_0_0_0_64_tmp_2, i64 666, i64 30, i64 18446744073709551615" [top.cpp:25]   --->   Operation 285 'specmemcore' 'specmemcore_ln25' <Predicate = true> <Delay = 0.00>
ST_8 : Operation 286 [1/1] (0.00ns)   --->   "%specmemcore_ln25 = specmemcore void @_ssdm_op_SpecMemCore, i24 %top_kernel_ap_fixed_64_ap_fixed_24_8_0_0_0_64_tmp_3, i64 666, i64 30, i64 18446744073709551615" [top.cpp:25]   --->   Operation 286 'specmemcore' 'specmemcore_ln25' <Predicate = true> <Delay = 0.00>
ST_8 : Operation 287 [1/1] (0.00ns)   --->   "%specmemcore_ln25 = specmemcore void @_ssdm_op_SpecMemCore, i24 %top_kernel_ap_fixed_64_ap_fixed_24_8_0_0_0_64_tmp_4, i64 666, i64 30, i64 18446744073709551615" [top.cpp:25]   --->   Operation 287 'specmemcore' 'specmemcore_ln25' <Predicate = true> <Delay = 0.00>
ST_8 : Operation 288 [1/1] (0.00ns)   --->   "%specmemcore_ln25 = specmemcore void @_ssdm_op_SpecMemCore, i24 %top_kernel_ap_fixed_64_ap_fixed_24_8_0_0_0_64_tmp_5, i64 666, i64 30, i64 18446744073709551615" [top.cpp:25]   --->   Operation 288 'specmemcore' 'specmemcore_ln25' <Predicate = true> <Delay = 0.00>
ST_8 : Operation 289 [1/1] (0.00ns)   --->   "%specmemcore_ln25 = specmemcore void @_ssdm_op_SpecMemCore, i24 %top_kernel_ap_fixed_64_ap_fixed_24_8_0_0_0_64_tmp_6, i64 666, i64 30, i64 18446744073709551615" [top.cpp:25]   --->   Operation 289 'specmemcore' 'specmemcore_ln25' <Predicate = true> <Delay = 0.00>
ST_8 : Operation 290 [1/1] (0.00ns)   --->   "%specmemcore_ln25 = specmemcore void @_ssdm_op_SpecMemCore, i24 %top_kernel_ap_fixed_64_ap_fixed_24_8_0_0_0_64_tmp, i64 666, i64 30, i64 18446744073709551615" [top.cpp:25]   --->   Operation 290 'specmemcore' 'specmemcore_ln25' <Predicate = true> <Delay = 0.00>
ST_8 : Operation 291 [1/1] (0.00ns)   --->   "%specmemcore_ln25 = specmemcore void @_ssdm_op_SpecMemCore, i24 %top_kernel_ap_fixed_64_ap_fixed_24_8_0_0_0_64_tmp_1, i64 666, i64 30, i64 18446744073709551615" [top.cpp:25]   --->   Operation 291 'specmemcore' 'specmemcore_ln25' <Predicate = true> <Delay = 0.00>
ST_8 : Operation 292 [1/1] (0.00ns)   --->   "%specmemcore_ln25 = specmemcore void @_ssdm_op_SpecMemCore, i24 %top_kernel_ap_fixed_64_ap_fixed_24_8_0_0_0_64_tmp_7, i64 666, i64 30, i64 18446744073709551615" [top.cpp:25]   --->   Operation 292 'specmemcore' 'specmemcore_ln25' <Predicate = true> <Delay = 0.00>
ST_8 : Operation 293 [1/1] (0.00ns)   --->   "%specmemcore_ln26 = specmemcore void @_ssdm_op_SpecMemCore, i24 %denom_row, i64 666, i64 18, i64 18446744073709551615" [top.cpp:26]   --->   Operation 293 'specmemcore' 'specmemcore_ln26' <Predicate = true> <Delay = 0.00>
ST_8 : Operation 294 [1/2] (0.00ns)   --->   "%call_ln0 = call void @top_kernel_Pipeline_VITIS_LOOP_90_8, i24 %C, i24 %scale_loc_load, i24 %scale_2_loc_load, i24 %scale_4_loc_load, i24 %scale_6_loc_load, i24 %scale_8_loc_load, i24 %scale_10_loc_load, i24 %scale_12_loc_load, i24 %scale_14_loc_load, i24 %scale_16_loc_load, i24 %scale_18_loc_load, i24 %scale_20_loc_load, i24 %scale_22_loc_load, i24 %scale_24_loc_load, i24 %scale_26_loc_load, i24 %scale_28_loc_load, i24 %scale_30_loc_load, i24 %scale_32_loc_load, i24 %scale_34_loc_load, i24 %scale_36_loc_load, i24 %scale_38_loc_load, i24 %scale_40_loc_load, i24 %scale_42_loc_load, i24 %scale_44_loc_load, i24 %scale_46_loc_load, i24 %scale_48_loc_load, i24 %scale_50_loc_load, i24 %scale_52_loc_load, i24 %scale_54_loc_load, i24 %scale_56_loc_load, i24 %scale_58_loc_load, i24 %scale_60_loc_load, i24 %scale_62_loc_load, i24 %scale_1_loc_load, i24 %scale_3_loc_load, i24 %scale_5_loc_load, i24 %scale_7_loc_load, i24 %scale_9_loc_load, i24 %scale_11_loc_load, i24 %scale_13_loc_load, i24 %scale_15_loc_load, i24 %scale_17_loc_load, i24 %scale_19_loc_load, i24 %scale_21_loc_load, i24 %scale_23_loc_load, i24 %scale_25_loc_load, i24 %scale_27_loc_load, i24 %scale_29_loc_load, i24 %scale_31_loc_load, i24 %scale_33_loc_load, i24 %scale_35_loc_load, i24 %scale_37_loc_load, i24 %scale_39_loc_load, i24 %scale_41_loc_load, i24 %scale_43_loc_load, i24 %scale_45_loc_load, i24 %scale_47_loc_load, i24 %scale_49_loc_load, i24 %scale_51_loc_load, i24 %scale_53_loc_load, i24 %scale_55_loc_load, i24 %scale_57_loc_load, i24 %scale_59_loc_load, i24 %scale_61_loc_load, i24 %scale_63_loc_load, i24 %top_kernel_ap_fixed_64_ap_fixed_24_8_0_0_0_64_tmp_7, i24 %top_kernel_ap_fixed_64_ap_fixed_24_8_0_0_0_64_tmp, i24 %top_kernel_ap_fixed_64_ap_fixed_24_8_0_0_0_64_tmp_5, i24 %top_kernel_ap_fixed_64_ap_fixed_24_8_0_0_0_64_tmp_3, i24 %top_kernel_ap_fixed_64_ap_fixed_24_8_0_0_0_64_tmp_1, i24 %top_kernel_ap_fixed_64_ap_fixed_24_8_0_0_0_64_tmp_6, i24 %top_kernel_ap_fixed_64_ap_fixed_24_8_0_0_0_64_tmp_4, i24 %top_kernel_ap_fixed_64_ap_fixed_24_8_0_0_0_64_tmp_2"   --->   Operation 294 'call' 'call_ln0' <Predicate = true> <Delay = 0.00> <CoreType = "Generic">   --->   Generic Core
ST_8 : Operation 295 [1/1] (0.00ns)   --->   "%ret_ln102 = ret" [top.cpp:102]   --->   Operation 295 'ret' 'ret_ln102' <Predicate = true> <Delay = 0.00>


============================================================
+ Verbose Summary: Timing violations
============================================================
Target clock period: 10.000ns, clock uncertainty: 2.700ns.

 <State 1>: 0.000ns
The critical path consists of the following:

 <State 2>: 1.980ns
The critical path consists of the following:
	'call' operation 0 bit ('call_ln0') to 'top_kernel_Pipeline_VITIS_LOOP_43_2_VITIS_LOOP_45_3' [170]  (1.980 ns)

 <State 3>: 0.000ns
The critical path consists of the following:

 <State 4>: 0.000ns
The critical path consists of the following:

 <State 5>: 5.101ns
The critical path consists of the following:
	'load' operation 24 bit ('col_sum_load') on local variable 'col_sum_load_loc' [172]  (0.000 ns)
	'call' operation 0 bit ('call_ln0') to 'top_kernel_Pipeline_VITIS_LOOP_78_6' [236]  (5.101 ns)

 <State 6>: 0.978ns
The critical path consists of the following:
	'call' operation 0 bit ('call_ln0') to 'top_kernel_Pipeline_VITIS_LOOP_78_6' [236]  (0.978 ns)

 <State 7>: 0.933ns
The critical path consists of the following:
	'load' operation 24 bit ('scale_63_loc_load') on local variable 'scale_63_loc' [237]  (0.000 ns)
	'call' operation 0 bit ('call_ln0') to 'top_kernel_Pipeline_VITIS_LOOP_90_8' [301]  (0.933 ns)

 <State 8>: 0.000ns
The critical path consists of the following:


============================================================
+ Verbose Summary: Binding
============================================================
N/A
* FSMD analyzer results:
  - Output states:
 - Input state : 
  - Chain level:
	State 1
	State 2
	State 3
	State 4
	State 5
	State 6
	State 7
	State 8


============================================================
+ Verbose Summary: Datapath Resource usage 
============================================================
N/A
